product-name;product-price
HC Care Yoğun Vitamin Destekli Saç Kremi 340 ml;499.90
Palette Deluxe Saç Boyası 6-0 Koyu Kumral;449.90
Ashley Joy Durulanmayan Saç Bakım Kremi 150 ml;649.90
Bioxcin Saç Bakım Yağı Besleyici Yağlar 100 ml;1219.90
Otacı Bitkisel Saç Şekillendirici Orta 150 ml;444.90
OGX Brezilya Keratin Şampuan 385 ml;749.90
Elseve Turunculaşma Karşıtı Mor Şampuan 200 ml;649.90
Elidor Şampuan Güçlü Parlak 650 ml;429.90
Biomagic Saç Boyası Kumral No: 7.00;699.90
Wella Professionals Fusion Yoğun Onarıcı Saç Kremi 200 ml;1739.90
Schwarzkopf Root Retoucher Root Retoucher Sprey Boya Kumral 120 ml;438.90
Bade Natural Biberiye Suyu Güçlendirici Saç Toniği 100 ml;759.90
Biomagic Saç Boyası Yoğun Çikolata Kahve No: 55.07;699.90
Aussie Miracle Moist Nemlendirici Şampuan 1 lt;1264.90
Urban Care Shake N Repair 7/24 Kabaran ve Bukleli Saçlara Özel Saç Bakım Köpüğü 150 ml;639.90
Herbal Essences Argan Yağlı Onarıcı Şampuan 350 ml;669.90
Otacı Botanics+ Dolgunluk & Hacim Veren Bakım Şampuan 375 ml;739.90
Toni&Guy Yıpranmış Saçlar için Yoğun Onarıcı Saç Maskesi 200 ml;1094.90
Aussie Bouncy Curls Arındıran Nemlendiren Şampuan 1 lt;1269.90
Wella Koleston Kit Saç Boyası Kahve 4/0;549.90
Palette Göz Alıcı Renkler Saç Boyası 7-77 Yoğun Bakır;267.90
Dove Saç Bakım Kremi Yoğun Onarıcı 350 ml;474.90
Pantene Serum Grow Abundant 60 ml;999.90
Morfose Keratin Çift Fazlı Fön Suyu 240 ml;419.90
Wella Koleston Kit Saç Boyası Işıltılı Kahve 7/77;549.90
Ashley Joy Bukle Belirginleştirici Kıvırcık ve Dalgalı Saçlara Özel Bakım Kremi 250 ml;589.90
Taft Curl and Flex Köpük 150 ml;417.90
Biomagic Saç Boyası Yoğun Küllü Açık Kumral No: 811;699.90
Urban Care Style Guide Wax Mat Görünümlü 100 ml;629.90
Pantene Şampuan Grow Abundant 290 ml;699.90
Mara Babyhair Styling Saç Maskarası;439.90
Ashley Joy Bukle Belirginleştirici Kıvırcık ve Dalgalı Saçlara Özel Bakım Şampuan 400 ml;699.90
Watsons Saç Köpüğü Bukle Belirginleştirici 200 ml;249.90
Morfose Supreme Saç Parfümü 100 ml;649.90
Urban Care Style Guide Wax Islak ve Sert Görünümlü 100 ml;629.90
Ashley Joy Şampuan Hacim Veren 400 ml;619.90
Ashley Joy Yoğun Onarıcı Şampuan 400 ml;619.90
Wella Koleston Intense Saç Boyası 10/81 Çok Açık Küllü İnci Sarısı;249.90
L'Oreal Paris Excellence Çikolata Kahve Saç Boyası 6.35;556.90
Batiste Kuru Şampuan Orijinal Seyahat Boy 50 ml;429.90
Elseve 10 Etki 1 Arada Saç Güzelleştirici Sprey Serum 150 ml;516.90
Head&Shoulders Derinlemesine Temiz Kaşıntı Giderici Nane 300 ml;364.90
Pantene Saç Serumu Heat&Glow Nem Yüklemesi 135 ml;709.90
Schwarzkopf Root Retoucher Sprey Boya Koyu Kahverengi 120 ml;438.90
Ashley Joy Dökülme Karşıtı Tonik Saç Spreyi 150 ml;1199.90
Gliss Supreme Length Sıvı Saç Bakım Kremi Biotin Kompleksi ve Şakayık Çiçeği Özü ile 200 ml;378.90
Urban Care Expert Şampuan Biotin Caffeine 350 ml;749.90
Elidor Serum Elektriklenme Karşıtı İpek Terapi 80 ml;609.90
Dove Coconut Besleyici Terapi Saç Güzelleştirici Krem 150 ml;699.90
Clear Women Şampuan Yumuşak&Parlak 500 ml;469.90
Biomagic Saç Boyası Şarap Kızılı No: 55.55;699.90
Elidor Saç Bakım Kremi Anında Onarıcı 350 ml;356.90
Garnier Çarpıcı Renkler Saç Boyası Parlak Açık Kahve No: 5,0;239.90
Ashley Joy Ekstra Hacim Kuru Şampuan 200 ml;449.90
Morfose Milk Keratin Şampuan 500 ml;529.90
Biomagic Saç Boyası Karamel No: 7.03;699.90
Egos Islak ve Sert Jöle 400 ml;324.90
Urban Care Jöle Style Guide Elastic Curl 150 ml;619.90
Herbal Essences Gül Esanslı Kadife Yumuşaklık Şampuan 350 ml;669.90
L'Oreal Paris Excellence Creme Saç Boyası Bronz Kahve 5.02;556.90
Matsu Harmony Saç Parfümü 50 ml;799.90
L'Oreal Paris Excellence Saç Boyası Ekstra Küllü Açık Kahve 5.11;556.90
Gliss Serum Deep Repair Onarıcı Saç Bakım Kremi Protein Kompleksi ve Hint İnciri ile 360 ml;260.90
L'Oreal Paris Excellence Efsanevi Türk Kahvesi Saç Boyası 5.15;556.90
Naturway Bitkisel Şampuan Sarımsaklı 500 ml;769.90
Dove Saç Maskesi Hindistan Cevizi Yağlı 265 ml;999.90
Mara Koyu Kahve Saç Maskarası;399.90
Wella Koleston Naturals Saç Boyası 8/1 Açık Küllü Kumral;249.90
Palette Göz Alıcı Renkler Saç Boyası 3-65 Çikolata Kahve;267.90
Taft Saç Köpüğü Power Cashmere 150 ml;417.90
Gliss 4'ü 1 Arada Ultimate Repair Onarıcı Saç Bakım Maskesi Sıvı Keratin ile 400 ml;589.90
Bioblas Saç Kremi Kolajen&Keratin 250 ml;407.90
Urban Care Style Guide Sea Salt Saç Spreyi 200 ml;599.90
Wella Professionals Nutricurls Milky Waves Besleyici Durulanmayan Bakım Spreyi 150 ml;1859.90
Gliss Blonde Perfector Turunculaşma Karşıtı Onarıcı Şampuan Peptit ve Yaban Mersini Özü ile 250 ml;432.90
Aussie Sos Kuru Yıpranmış Saçlar için Saç Maskesi 500 ml;969.90
Pantene Güç Ve Parlaklık Şampuan 800 ml;599.90
Wella Professionals Nutricurls Curlixir Kıvırcık Saçlar İçin Bukle Belirginleştirici Balm 150 ml;1859.90
Urban Care Intense and Keratin Sıvı Saç Kremi 200 ml;569.90
Taft Power Express Saç Spreyi 250 ml;417.90
Pantene Saç Kremi Nem Yüklemesi 275 ml;334.90
Urban Care Kuru Şampuan Monoi&Ylang 200 ml;649.90
Matsu Sun Day Isıya Karşı Saç Bakım Spreyi 200 ml;699.90
Urban Care No.6 Bond Plex Yıpranma Karşıtı Saç Bakım Yağı 100 ml;849.90
Wellaflex Curls Saç Köpüğü Güçlü 200 ml;304.90
Wella Professionals Color Motion+ Renk Koruyucu Saç Kremi 200 ml;1739.90
Wella Koleston Kit Saç Boyası Açık Küllü Kumral 8/1;549.90
Naturals By Watsons Rosemary Şampuan 490 ml;549.90
Restorex Sağlıklı Uzama Etkili Dökülme Karşıtı Şampuan 500 ml;258.90
Urban Care Style Guide Saç Köpüğü Elastic Curl 200 ml;699.90
Morfose Ultra Strong Saç Spreyi 75 ml;179.90
Matsu Pillow Saç Parfümü & Body Mist 50 ml;899.90
Koleston Saç Boyası Sarı 9/0;549.90
Urban Care Twisted Curls Hibiscus & Shea Butter Bukle Belirginleştirici Onarıcı Saç Bakım Köpüğü 150 ml;639.90
L'Oreal Paris Excellence Saç Boyası Nude Koyu Kumral 6U;606.90
Urban Care No.4 Bond Plex Yıpranma Karşıtı Yoğun Onarım Maskesi 230 ml;689.90
Biomagic Saç Boyası Kahve Köpüğü No: 6.03;699.90
Dove Saç Serumu Yoğun Onarıcı 80 ml;999.90
Herbal Essences Saç Spreyi Gül Esanslı 145 ml;669.90
Revox Şampuan Keratin ve Ozon Yağı E Vitamini Bakımı 360 ml;674.90
Dove Saç Bakım Kremi Peptid Bond Repair 250 ml;499.90
Ashley Joy Matcha Gloss Glikolik Asit İçeren Işıltı ve Parlaklık Veren Şampuan 400 ml;699.90
Morfose Milk Therapy Kremsi Süt Maskesi Seyahat Boy 25 ml;54.95
Morfose Ekstra Hacim Kuru Şampuan 200 ml;374.90
Elidor Şampuan Ultra Işıltı 400 ml;439.90
Elidor Şampuan Onarıcı Bakım 325 ml;209.90
Elidor Brezilya Keratin Terapisi Yoğun Onarıcı Saç Maskesi 220 ml;534.90
Urban Care Glycolic Retinol Parlaklık Etkili Duş Öncesi Saç Bakım Maskesi 50 ml;189.90
Wella Koleston Intense Saç Boyası 6/7 Çikolata Kahve;249.90
Biomagic Saç Boyası Küllü Kumral No: 7.72;699.90
Clear Men Şampuan Ronaldo 500 ml;469.90
Morfose Milk Therapy Butter Mucizevi Saç Bakım Yağı 200 ml;419.90
Elidor Sıvı Saç Bakım Sütü Brezilya Keratin Terapisi Hidrolize Keratin Marula Yağı E Vitamini 200 ml;489.90
Wella Koleston Kit Boya Açık İnci Küllü Kumral 8.18;549.90
OGX Şampuan Rosemary Mint 385 ml;749.90
Duru Şampuan Dökülme Karşıtı 400 ml;278.90
Watsons Kuru Şampuan Coconut 200 ml;199.90
Wella Koleston Kit Saç Boyası Aşk Alevi 66/46;549.90
Pantene Onarıcı ve Koruyucu Saç Bakım Kremi 275 ml;339.90
Elidor Saç Bakım Kremi Ultra Işıltı 350 ml;449.90
L'Oreal Paris Elseve Growth Booster Dökülme Karşıtı Şampuan 200 ml;704.90
Elidor Deniz Tuzu Spreyi Belirgin Bukleler 190 ml;479.90
Morfose Extra Strong Saç Spreyi 270 ml;399.90
Bioblas Collagen and Keratin Şampuan 360 ml;299.90
Urban Care Glycolic Retinol Parlaklık Etkili Onarıcı Saç Bakım Şampuanı 350 ml;669.90
Elseve Mucizevi Yağ Besleyici Saç Bakım Kremi 250 ml;329.90
Biomagic Premium Saç Boyası 10/28 Açık Sarı İnci Küllü;749.90
Dove Şampuan Yoğun Onarıcı 375 ml;439.90
Urban Care Argan Oil ve Keratin Günlük Yoğun Saç Bakım Kremi;659.90
L'Oreal Paris Excellence Koyu Kestane Saç Boyası 3;556.90
Elidor Saç Bakım Şampuanı Sağlıklı Uzayan Saçlar 400 ml;284.90
Sea Color Saç Boyası Mavi Siyah 1.1;376.90
Dove Durulanmayan Saç Kremi Bond Repair 150 ml;699.90
Head&Shoulders Derinlemesine Temiz Yoğun Ferahlık Deniz Mineralleri 300 ml;364.90
Palette Kalıcı Doğal Renkler Saç Boyası 8-0 Bal Köpüğü;267.90
Duru Şampuan Güçlü ve Parlak 400 ml;278.90
Gliss Aqua Revive Nemlendirici Saç Bakım Kremi Hyaluron ve Deniz Yosunu Özü ile 360 ml;260.90
Elidor Sıvı Saç Kremi Ultra Işıltı 200 ml;489.90
Toni&Guy Yıpranmış Saçlar İçin Özel Bakım Şampuanı 250 ml;799.90
Head&Shoulders DermaXPRO Scalp&Hair Revitaliser Dökülme ve Kepek Karşıtı Şampuan Kafein ve Seramid 300 ml;524.90
Wella Professionals Nutricurls Kıvırcık Saçlar İçin Micellar Şampuan 250 ml;1499.90
Creme Supreme Saç Boyası Küllü Soğuk Kumral 7-16;749.90
Pantene Pro-V Keratin Koruyucu Maske 200 ml;434.90
Tangle Teezer Saç Fırçası Mini Turkuaz;749.90
Wella Professionals Oil Reflections Işıltı Sağlayan Saç Kremi 200 ml;1739.90
L'Oreal Paris Excellence Sarı Küllü Saç Boyası 9.1;556.90
Naturway Şampuan Sarımsak Özlü Dökülme ve Kepek Karşıtı 500 ml;809.90
Clear Women Kepeğe Karşı Etkili Şampuan Bitkisel Sentez 350 ml;149.00
Elidor Saç Kremi Belirgin Bukleler 350 ml;356.90
Urban Care Sıvı Saç Kremi Ha ve Collagen 200 ml;569.90
Palette Göz Alıcı Renkler Saç Boyası 10-1 Küllü Açık Sarı;267.90
Bioxcin Şampuan Besleyici Yağlar 300 ml;634.90
L'Oreal Paris Excellence Koyu Sarı Küllü Saç Boyası 8.1;556.90
Urban Care Biotin Expert Peeling Şampuan 200 ml;869.90
Otacı Botanics + Onarıcı & Güçlendirici Bakım Balkabağı ve Bitkisel Keratin İçeren Bitkisel Şampuan 375 ml;739.90
Creme Supreme Saç Boyası Soğuk Kahve 5-1;749.90
Palette Deluxe Saç Boyası 4-65 Büyüleyici Kahve;449.90
Egos Ultra Güçlü Tutuş Jöle 400 ml;324.90
Garnier Color Shampoo Retouch 2.0 Soft Black;189.90
Urban Care No.5 Bond Plex Yıpranma Karşıtı Saç Bakım Sütü 200 ml;669.90
Palette Göz Alıcı Renkler Saç Boyası 7-1 Küllü Kumral;267.90
Pantene Pro-V Active Nutri-Plex Şampuan Nem Yüklemesi 400 ml;369.90
Palette Deluxe Saç Boyası 5-60 Sıcak Çikolata;449.90
L'Oreal Paris Magic Retouch Beyaz Saçlar İçin Kapatıcı Kahverengi Saç Spreyi 75 ml;471.90
Miine Sparkling Saç Fırçası;199.90
Koleston Naturals Saç Boyası Büyüleyici Kahve 6/1;249.90
Urban Care Expert Saç Toniği Biotin&Caffeine 200 ml;609.90
Biomagic Saç Boyası Kahve No: 4.00;699.90
Bioblas Botanic Oils Argan Saç Bakım Yağı 100 ml;482.90
Morfose Saç Maskesi Üçgen Milk Therapy 25 ml;59.95
Gliss Saç Kremi Full Hair Wonder 360 ml;260.90
HC Care Maske Ovex Saç Kurtarma ve Canlandırma 200 ml;565.90
Toni&Guy Yıpranmış Saçlar için Yoğun Onarıcı Saç Kremi 250 ml;799.90
Urban Care Expert Biotin ve Caffein Saç Kremi 200 ml;669.90
Wella Professionals Oil Reflections Işıltı Sağlayan Şampuan 250 ml;1499.90
Bioblas Sıvı Saç Kremi Kolajen ve Keratin 200 ml;407.90
Ashley Joy Matcha Gloss Glikolik Asit İçeren Işıltı ve Parlaklık Veren Saç Bakım Kremi 250 ml;859.90
Urban Care Intense Keratin Yoğun Hasar Onarıcı Saç Bakım Kremi 250 ml;439.90
Bioxcin Collagen ve Biotin Şampuan 300 ml;634.90
Nascita Fön Fırçası Side05A;584.90
Naturals By Watsons Argan Saç Yağı 100 ml;629.90
Urban Care Glycolic Retinol Parlaklık Etkili Onarıcı Saç Bakım Serumu 100 ml;799.90
L'Oreal Paris Excellence Koyu Sarı Saç Boyası 8;556.90
Bioblas Şekillendirici Krem Kolajen ve Keratin 250 ml;407.90
Garnier Çarpıcı Renkler Saç Boyası 111 Ekstra Açık Gümüş Sarısı;239.90
Urban Care Saç Serumu Expert Biotin&Caffein 50 ml;899.90
Palette Kalıcı Doğal Renkler Saç Boyası 7-5 Açık Karamel;267.90
L'Oreal Paris Excellence Kahve Saç Boyası 4;556.90
Aussie Sos Blonde Hydrate Mor Şampuan 500 ml;969.90
Pantene Saç Kremi Grow Abundant 250 ml;699.90
Urban Care Hibiscus & Shea Yağı Bukle Belirginleştirici Saç Bakım Kremi 250 ml;519.90
Wella Koleston Naturals Saç Boyası 6/0 Koyu Kumral;249.90
Morfose Supreme Çift Fazlı Fön Suyu 240 ml;419.90
Head&Shoulders Dermaxpro Yatıştırıcı Saç Kremi 220 ml;419.90
Wella Professionals Elements Yatıştırıcı Şampuan 250 ml;1499.90
Nascita Pro Saç Fırçası Pembe;269.90
Elidor Saç Kremi İpek Terapisi 350 ml;449.90
Biomagic Saç Boyası Açık Sarı No: 10.00;699.90
Matsu Intensive Repair Yıpranmış Saçlar Şampuan 350 ml;699.90
Palette Naturel Göz Alıcı Renkler Saç Boyası 12-21 Gümüş Sarı;267.90
Miine Cherry Pop Saç Bigudisi 6 Adet;249.90
Wella Professionals Oil Reflections Işıltı Sağlayan Saç Maskesi 150 ml;1529.90
Palette Kalıcı Doğal Renkler Saç Boyası 8-77 Tarçın Bakır;267.90
Watsons Blossom Me Kuru Şampuan 200 ml;299.90
Taft Keratin Sprey 250 ml;417.90
Elidor Serum Bakım Kremi Brezilya Keratin Terapisi Hidrolize Keratin Marula Yağı E Vitamini 350 ml;449.90
Pantene Kıvırcık Saçlar İçin 7/24 Saç Bakım Kremi 300 ml;559.90
Morfose Milk Therapy Saç Parfümü 100 ml;649.90
Herbal Essences Gül Esanslı Kadife Yumuşaklık Saç Kremi 250 ml;669.90
Palette Deluxe Saç Boyası 10-1 Küllü Açık Sarı;449.90
Dove Şampuan Avocado Dökülme Karşıtı 375 ml;439.90
Wella Professionals Fusion Yoğun Onarıcı Saç Maskesi 150 ml;1529.90
Urban Care Hyaluronic Acid & Collagen Ekstra Dolgunlaştırıcı Saç Bakım Kremi 250 ml;439.90
Elidor Şampuan İpek Terapisi 400 ml;439.90
Ashley Joy Saç Maskesi Onarıcı 30 ml;159.90
Palette Kalıcı Doğal Renkler Saç Boyası 3-68 Kızıl Çikolata;267.90
Elidor Şampuan Belirgin Bukleler 400 ml;329.90
Pantene Saç Kremi Miracle Güç&Parlaklık 220 ml;479.90
Pantene Şampuan Güç ve Parlaklık 400 ml;369.90
Bioblas Forte Şampuan 360 ml;339.90
Wella Koleston Kit Saç Boyası Patlıcan Moru 3/66;549.90
Watsons Saç Boyası Çıkarıcı Mendil 6 Adet;84.95
Morfose Milk Therapy Saç Spreyi 250 ml;439.90
Gliss Split Hair Miracle Kırık Uçları Mühürleyen Sıvı Saç Bakım Kremi İyonik Kompleks ve Üzüm Çekirdeği Yağı ile 200 ml;378.90
Wella Koleston Kit Saç Boyası Kışkırtıcı Kahve 5/37;549.90
HC Care Brezilya Fönlü Saç Sülfatsız Şampuan 340 ml;499.90
Dove Şampuan Hindistan Cevizi Yağlı 375 ml;439.90
L'Oreal Paris Excellence Saç Boyası Ekstra Küllü Sarı 8.11;556.90
Tangle Teezer Saç Fırçası Mini Sarı;749.90
Creme Supreme Saç Boyası Ultra Yoğun Renk Açıcı;894.90
Elidor Superblend Serum Saç Bakım Kremi Güçlü ve Parlak E Vitamini Makademya Yağı & Keratin 350 ml;356.90
Matsu Bonding Saç Bakım Maskesi 350 ml;799.90
Revox Şampuan Amino Asit 400 ml;719.90
Elidor Saç Güzelleştirici Bakım Kremi 130 ml;499.90
Watsons Love Is In The Hair Milk Kuru Şampuan 200 ml;299.90
Morfose Keratin Saç Maskesi Seyahat Boy 25 ml;54.95
Head&Shoulders DermaXPRO Scalp&Hair Revitaliser Dökülme Karşıtı Saç ve Saç Derisi Bakım Kremi Kafein ve Seramid 220 ml;474.90
OGX Şampuan Bond Protein Repair 385 ml;839.90
Pantene Saç Yağı Love Keratin Koruması 100 ml;604.90
Sea Color Şampuan Express Boya Koyu Kumral 6.0;204.90
Gliss Şampuan Ultimate Repair 400 ml;279.90
Morfose Metamorfose Arındırıcı Bakım Şampuanı 400 ml;459.90
Urban Care Saç Maskesi Ha ve Collagen 50 ml;169.90
Urban Care Argan Yağı ve Keratin Kırılma Karşıtı Durulanmayan Saç Bakım Kremi 150 ml;549.90
Nascita Ahşap Topuz Fırçası;469.90
Urban Care Hyaluronic & Collagen Ekstra Dolgunlaştırıcı Saç Bakım Şampuanı 350 ml;439.90
L'Oreal Paris Magic Retouch Beyaz Saçlar İçin Kapatıcı Kumral Saç Spreyi 75 ml;471.90
Duru Saç Kremi Güçlü ve Parlak 375 ml;278.90
Elidor Saç Serumu Ultra Işıltı 90 ml;609.90
Neva Root Touch-Up Kapatıcı Sprey Sari 75 ml;389.90
Palette Kalıcı Doğal Renkler Saç Boyası 5-0 Açık Kahve;267.90
Aussie Sos Blonde Hydrate Saç Kremi 350 ml;969.90
Taft x Gliss Fön Suyu Blow Mist 150 ml;479.90
Urban Care No.1 Bond Plex Yıpranma Karşıtı Şampuanlama Öncesi Saç Bakım Maskesi 50 ml;209.90
Wella Koleston Kit Saç Boyası Küllü Kumral 7/1;549.90
Duru Saç Kremi Yoğun Onarım Ve Nem 385 ml;278.90
Clear Men 3in1 Şampuan ve Duş Jeli Arındırıcı Kömür 350 ml;469.90
Biomagic Saç Boyası Yoğun Küllü Koyu Kumral No: 6.11;699.90
Morfose Ossion Mat Styling Wax 100 ml;229.90
Bioxcin Saç Maskesi Keratin ve Argan 225 ml;1309.90
Koleston Naturals Saç Boyası Kahve 4/0;249.90
Wella Koleston Naturals Saç Boyası 2/0 Siyah;249.90
Palette Göz Alıcı Renkler Saç Boyası 6-88 Yoğun Kızıl;267.90
Ashley Joy Matcha Gloss Glikolik Asit İçeren Işıltı ve Parlaklık Veren Saç Bakım Sütü 150 ml;699.90
Morfose Metamorfose Onarıcı Bakım Şampuanı 400 ml;459.90
Morfose Metamorfose Nemlendirici Bakım Saç Kremi 250 ml;459.90
Urban Care Style Guide Max Hold Saç Spreyi 250 ml;769.90
Pantene Saç Kremi Miracles Kıvırcık Saçlar 275 ml;444.90
Taft Powerful Age Saç Köpüğü 150 ml;417.90
Pantene Saç Maskesi Grow Abundant 300 ml;899.90
Bioblas Botanic Oils Sarımsak Özlü Şampuan 360 ml;299.90
Gliss Oil Nutritive Şampuan 400 ml;279.90
Naturals By Watsons Argan Saç Kremi 490 ml;519.90
Taft Ultimate Sprey 250 ml;417.90
HC Care Saç Bakım Maskesi Duo 40 ml;159.90
Urban Care Hibiscus & Shea Butter Bukle Belirginleştirici Saç Bakım Şampuanı 350 ml;519.90
Naturals By Watsons Argan Şampuan 490 ml;549.90
Naturals By Watsons Coconut Saç Kremi 490 ml;519.90
Wella Koleston Kit Saç Boyası Açık Kahve 5/0;549.90
Palette Deluxe Saç Boyası 6-888 Sonbahar Kızılı;449.90
L'Oreal Paris Magic Retouch Beyaz Saçlar İçin Kapatıcı Siyah Saç Spreyi 75 ml;471.90
HC Care Saç Bakım Yağı Bitkisel 200 ml;1385.90
Palette Deluxe Uil Ultra Yoğun Renk Açıcı;539.90
Head&Shoulders Şampuan Old Spice 330 ml;369.90
Gliss Sıvı Saç Kremi Full Hair Wonder 200 ml;378.90
Wella Koleston Peroksit 9% Sıvı Oksidasyon Kremi;64.95
Gliss Aqua Revive Nemlendirici Şampuan Hyaluron ve Deniz Yosunu Özü ile 400 ml;279.90
L'Oreal Paris Magic Retouch Beyaz Saçlar İçin Kapatıcı Koyu Kahverengi Saç Spreyi 75 ml;471.90
Naturals By Watsons Hindistan Cevizli Şampuan 490 ml;549.90
Palette Kalıcı Doğal Renkler Saç Boyası 7-0 Kumral;267.90
Watsons Kuru Şampuan Tropik 200 ml;199.90
Biomagic Saç Boyası Açık Kahve No: 5.00;699.90
Urban Care Coconut Kuru Şampuan 200 ml;649.90
Bioxcin Keratin ve Argan Şampuan 300 ml;634.90
Urban Care Curl Shea ve Hibiscus Sıvı Saç Kremi 200 ml;569.90
Nascita Pro Saç Fırçası Turuncu;344.90
Taft Saç Köpüğü Ultra Güçlü 150 ml;417.90
Morfose Milk Therapy Kremsi Süt Maskesi 75 ml;214.90
Taft Ekstra Güçlü Sprey 250 ml;417.90
Wella Koleston Intense Saç Boyası 4/1 Küllü Kahve;249.90
Urban Care Kind Rituals Şampuan Kinoa&Almond 400 ml;689.90
Sea Color Saç Boyası Açık Kumral 8.0;376.90
Restorex Şampuan 7 Besleyici Yağ 500 ml;258.90
Pantene Doğal Sentez Güç Parlak Saç Kremi 275 ml;339.90
Nascita Pro Lollipop Açma Tarama Fırçası Pembe;299.90
Palette Kalıcı Doğal Renkler 9-7 Doğal Açık Bakır;267.90
Elidor Şampuan ve Saç Bakım Kremi Güçlü ve Parlak 400 ml;329.90
Bioblas Biotin&Kafein Tonik 200 ml;407.90
Urban Care Glycolic Retinol Parlaklık Etkili Onarıcı Saç Bakım Kremi 250 ml;599.90
Palette Deluxe Saç Boyası 4-99 Patlıcan Moru;449.90
Egos Islak Sert Jöle 250 ml;236.90
Taft x Gliss Saç Spreyi Hold Me Softly 250 ml;479.90
Palette Göz Alıcı Renkler Saç Boyası 1-0 Siyah;267.90
Naturals By Watsons Olive Şampuan 490 ml;549.90
Taft Volume Saç Spreyi 250 ml;417.90
Palette Göz Alıcı Renkler Saç Boyası Koyu Sarı 8-0;228.90
Urban Care Style Guide Stick Wax 35 g;529.90
Bioblas Phytokeratin Şampuan 1000 ml;564.90
Restorex Saç Bakım Yağı 7 Besleyici 80 ml;419.90
OGX Saç Serumu Bond Protein Repair 50 ml;839.90
Pantene Saç Kremi Miracle Nem Yüklemesi 220 ml;479.90
Morfose Stick Wax 55 g;454.90
Biomagic Premium Saç Boyası 8/28 Açık Kumral İnci Küllü;749.90
OGX Saç Kremi Bond Protein Repair 385 ml;839.90
Palette Kalıcı Doğal Renkler Saç Boyası 1-0 Siyah;267.90
Naturals By Watsons Tea Tree Şampuan 490 ml;549.90
Bioblas Sıvı Saç Kremi Argan 200 ml;407.90
Morfose Saç Spreyi Kinoa&Kenevir 250 ml;419.90
Herbal Essences Argan Yağlı Onarıcı Saç Maske 300 ml;669.90
Pantene Onarıcı Bakım 7/24 Saç Bakım Kremi 300 ml;559.90
Wella Koleston Single Tüp Boya 3/0 Koyu Kahve;129.90
Garnier Çarpıcı Renkler Saç Boyası 1.0 Ekstra Yoğun Siyah;239.90
Urban Care Style Guide Saç Köpüğü Sea Salt 200 ml;669.90
Wella Koleston Kit Saç Boyası Kızıl Büyü 55/46;549.90
Garnier Çarpıcı Renkler Saç Boyası Yoğun Kumral No: 7;239.90
OGX Saç Yağı Bond Protein Repair 3in1 50 ml;839.90
Naturals By Watsons Olive Saç Kremi 490 ml;519.90
L'Oreal Paris Magic Retouch Beyaz Saçlar İçin Kapatıcı Altın Kahverengi Saç Spreyi 75 ml;471.90
L'Oreal Paris Excellence Kumral Küllü Saç Boyası 7.1;556.90
OGX Saç Kremi Rosemary Mint 385 ml;749.90
Wellaflex 2Days Volume Spray Extra Güçlü 400 ml;437.90
Urban Care Hibiscus ve Shea Butter Yoğun Saç Bakım Maskesi 230 ml;659.90
Matsu Saç Maskesi Yoğun Nem Bakımı 350 ml;799.90
Urban Care Kuru Şampuan Lychee Breeze 200 ml;649.90
Eloque Saç Parfümü Keratin 100 ml;224.90
Yoon Güçlendirici Saç Serumu 100 ml;349.50
Wella Koleston Kit Boya Işıltılı İnci Küllü Kumral 7.18;549.90
Naturals By Watsons Rosemary Saç Kremi 490 ml;519.90
Morfose Milk Therapy Kremsi Süt Şampuan 500 ml;444.90
OGX Saç Bakım Maskesi Brazilian Keratin Smooth 300 ml;749.90
Mara Açık Kahve Saç Maskarası;399.90
Duru Şampuan Yoğun Onarım ve Nemlendirme 400 ml;278.90
Urban Care Argan Oil Saç Bakım Serumu 75 ml;549.90
Palette Kalıcı Doğal Renkler 8-16 Küllü Sarı;267.90
Wellaflex 2Days Volume Köpük Extra Güçlü 200 ml;304.90
Bioxcin Keratin & Argan Sıvı Saç Kremi 200 ml;789.90
Bioxcin Forte Tonik 200 ml;874.90
Clear Scalpceuticals Saç Dökülmesine Karşı Şampuan 300 ml;589.90
Elidor Şampuan Anında Onarıcı 500 ml;359.90
Hydra Seramik Fön Fırçası 33 mm;449.90
Naturals By Watsons Argan Seyahat Seti 100 ml x3;649.90
Duru Sıvı Saç Kremi Yoğun Onarım Ve Nem 200 ml;428.90
Clear Men Şampuan Redbull Kepeğe Karşı 330 ml;469.90
Youpick Mandal Toka Siyah 2'li;74.95
Morfose Saç Bakım Şampuani Kinoa&Kenevir 500 ml;574.90
L'Oreal Paris Excellence Creme Saç Boyası Yoğun Siyah 200;556.90
Miine Basic Tel Toka 60'lı;109.90
Taft x Gliss Sıvı Saç Kremi Lovely Long 150 ml;479.90
Matsu Saç Parfümü Myth 50 ml;799.90
Urban Care No.2 Bond Plex Yıpranma Karşıtı Saç Bakım Şampuanı 350 ml;749.90
Good Sense Saç Vitamini Onarıcı & Besleyici;160.90
Gliss Şampuan Split Hair Miracle 400 ml;279.90
Bioxcin Collagen & Biotin Hacim Veren Saç Bakım Kremi 250 ml;634.90
Morfose Ossion Mat Putty Wax Seyahat Boy 60 ml;219.90
Hydra Prof Ahşap Topuz Fırçası Hd-2113;369.90
Miine Basic Bağlama Tokası Siyah 70'li;199.90
Aussie Sos Super Serum Durulanmayan Serum 160 ml;824.90
Pantene Saç Kremi Miracle Onarıcı&Koruyucu 220 ml;479.90
Urban Care Kuru Şampuan Peonies Roses Bouquet 200 ml;649.90
Nascita Hacim Verici Bigudi Klipsi 2'li;159.90
Biomagic Saç Boyası Küllü Sarı No: 9.72;699.90
Garnier Çarpıcı Renkler Saç Boyası Buzlu Kestane No: 4,15;239.90
Bioxcin Biotin Şampuan 300 ml;549.90
Morfose Saç Maskesi Süt Bal 25 ml;54.95
Matsu Mystique Blossom Saç Parfümü 50 ml;799.90
Bioxcin Yağlı Saçlar İçin Şampuan 300 ml;549.90
Biomagic Premium Saç Boyası 9/28 Sarı İnci Küllü;749.90
Elidor Isı İle Aktifleşen Keratin Bakım Kürü Brezilya Keratin Terapisi Hidrolize Keratin Marula Yağı E Vitamini 90 ml;609.90
Matsu Saç Serumu Rosemary Scalpify 50 ml;699.90
Morfose Fön Suyu Acıbadem 240 ml;574.90
Okay Professionnel Keratin Smooth Saç Bakım Yağı 125 ml;479.90
Bade Natural Saç Serumu Biberiye Dökülme Karşıtı 50 ml;779.90
Head&Shoulders Derin Nemlendirici Kepek Hindistan Cevizi Yağlı Günlük Kullanım Şampuan 330 ml;369.90
Mara Açık Kumral Saç Maskarası;399.90
Watsons Oksidasyon Losyonu %6 50 ml;69.95
Watsons Onarıcı Keratin Kapsül Saç Serumu 6 Adet;299.90
Watsons Love Is In The Hair Milk Şampuan 300 ml;299.90
Pantene Sunkiss Glow Saç Bakım Spreyi 200 ml;669.90
Batiste Kuru Şampuan Blush 200 ml;619.90
Restorex Kolajen & Biotin Dolgunlaştırıcı Sıvı Saç Bakım Kremi 200 ml;348.90
Taft Volume Köpük 150 ml;417.90
Wella Koleston Intense Saç Boyası 7/3 Fındık Kabuğu;249.90
Naturals By Watsons Aloe Vera Şampuan 490 ml;549.90
Creme Supreme Saç Boyası Siyah 7-0;749.90
L'Oreal Paris Excellence Kumral Saç Boyası 7;556.90
Dove Saç Bakım Kremi Uzun Saç Terapisi 350 ml;474.90
Palette Kalıcı Doğal Renkler Saç Boyası 12-1 Küllü Buzul Sarısı;267.90
Clear Women Kepeğe Karşı Etkili Saç Bakım Şampuanı Hyaluron Nem Terapisi 350 ml;389.90
Urban Care Intense Keratin Yoğun Hasar Onarıcı Saç Bakım Şampuanı 350 ml;439.90
Schwarzkopf Root Retoucher Sprey Boya Siyah 120 ml;438.90
Bioblas Biotin&Kafein Şampuan 400 ml;299.90
Pantene Şampuan Onarıcı & Koruyucu 400 ml;369.90
Elidor Saç Bakım Şampuanı Saç Dökülmelerine Karşı 400 ml;329.90
Watsons Love Is In The Hair Milk Fön Sütü 250 ml;349.90
