product-name;product-price
Nivea Kadın Stick Deodorant Pearl&Beauty 50 ml;399.90
Parodontax Beyazlatıcı Diş Macunu 75 ml 1+1;609.90
Orkid Platinum Dörtlü Gece 24'lü;441.90
Kotex Ultra Quadro Gece 16 adet;307.90
Veet Professional Bikini Bölgesi Özel Tüy Dökücü Krem Seti 50ml + 50ml;953.90
Sensodyne Hızlı Rahatlama Diş Macunu Beyazlatıcı 75 ml;379.90
Dove Beauty Cream Bar Original Yumuşak Pürüzsüz Bir Cilt İçin Nemlendirici Krem 4x90 g;299.90
Le Petit Marseillais Duş Jeli Organik Vanilya Sütü 400 ml + Organik Şeftali ve Nektarin 400 ml;735.90
Sebamed Roll-On Sensitive 50 ml;665.90
Marvis Sensitive Gums Ağız Bakım Suyu 400 ml;499.90
Molped Hijyen Max Gece Ped Süper Eko 14'lü;344.90
Dalin Teen Yüz Nemlendiricisi 65 ml;487.90
Naturals By Watsons Sakura Duş Jeli 490 ml;399.90
Kotex Natural Ultra Quadro Uzun 16;315.90
Boost & Bliss Body Mist 777 100 ml;449.90
Rexona Clinical Protection Confidence 96 Saat Koruma Antiperspirant Kadın Roll-On 45 ml;499.90
Listerine Advanced Whitening Ağız Suyu 500 ml;379.90
Watsons Islak Mendil Sakura 3x10 Adet;99.95
Colgate Max White Kalıcı Beyazlık Beyazlatıcı Diş Macunu 75 ml;194.90
Duru Okyanus Esintisi Fresh Duş Sabunu 600 g;248.90
Avon Incandessence Lotus Kadın Parfüm EDP 50 ml;1119.90
Watsons Kremli Duş Jeli Vanilya 1 lt;219.90
Nivea Men Erkek Sprey Deodorant Black & White Invisible Fresh 150 ml;369.90
Dalin Bebek Şampuanı 900 ml;369.90
Kotex Günlük Anydays Normal 56 Adet;330.90
Dove Sprey Deodorant Dragon&Coconut 150 ml;389.90
Marvis Strong Mint Ağız Bakım Suyu 400 ml;409.90
Colgate Plax Serin Nane Ağız Bakım Suyu 500 ml;375.90
Molped Pure And Soft Normal Süper Ekonomik 24 Adet;359.90
Molped Hijyen Max Uzun Ped Süper Eko 16'lı;344.90
Nivea Fresh Sensation Kadın Sprey Deodorant 150 ml 72 Saat Anti-perspirant Koruma;369.90
Orkid Ultra Extra Tekli Gece Extra 5 Adet;109.90
Privacy Addiction Kadın EDT 100 ml;1279.90
Gillette Venus Kullan At Tıraş Bıçağı 4'lü Paket;162.90
Colgate 360 Optik Beyaz Beyazlatıcı Orta Diş Fırçası 1+1;450.90
Avon Attraction Kadın Parfüm EDP 50 ml;1579.90
Orkid Platinum Dörtlü Normal 32'li;441.90
Colgate Optic White Aktif Kömür 75 ml;435.90
Dove Kadın Sprey Deodorant Eventone Kalendula Özü 150 ml;389.90
Johnson's Işıldayan Parlaklık Bebek Şampuanı 750 ml;368.90
Palmolive Aroma Sensations Feelgood Duş Jeli 500 ml;329.90
Sensodyne Yumuşak Diş Eti Bakımı Diş Fırçası 1+1;352.90
Veet Profesyonel Tüy Dökücü Krem Bacak ve Vücut 400 ml;1198.90
Angie Dream Vücut Spreyi Vanilla 250 ml;599.90
Orkid Platinum Normal Boy 1 14 Adet Hijyenik Ped;252.90
Dove Nemlendirici Duş Jeli Avokado Yağı ve Kalendula Özü 450 ml;459.90
Nivea Pearl Beauty Roll-On 50 ml;311.90
Sensodyne Diş Macunu Klinik Beyazlık Diş Lekesi 75 ml;499.90
Dove Sugar Cookie Duş Jeli 450 ml;459.90
Rexona Üstün Koruma Kadın Roll On Deodorant Invisible 72 Saat Kesintisiz Koruma 50 ml;299.90
Opalescence Beyazlatıcı Sensitivity Relief Diş Macunu 28 g;379.90
Watsons Kare Makyaj Temizleme Pamuğu 150+60 Adet;89.95
The Ceel Aktif Mor Karbon Beyazlatma Seti;455.90
Orkid Ultra Ekstra Dörtlü Hijyenik Ped Gece Max 8'li;256.90
White Glo Diş Macunu Smokers Formula 100 ml;549.90
Rexona Kadın Sprey Deodorant Mystic Love %0 Alüminyum 48 Saat 150 ml;339.90
Le Petit Marseillais Frambuaz ve Şakayık Duş Jeli 400 ml;369.90
Rexona Men Erkek Sprey Deodorant Xtra Cool 72 Saat Kesintisiz Üstün Koruma 150 ml;339.90
Gillette Venus ComfortGlide Breeze Tıraş Bıçağı x4;1152.90
Dalin Pompalı Bebek Şampuanı 500 ml;264.90
Sebamed Bebek Losyonu 200 ml;752.90
Oral-B iO Gentle Care Şarjlı Diş Fırçası Yedek Başlığı 4'lü;2699.90
Axe Premium Collection Erkek Sprey Deodorant Blue Lavender 72 Saat Ferahlık 150 ml;487.90
Unfilter Beauty Kadın Parfüm EDT Soft Glow 50 ml;499.90
Orkid Ultra Hijyenik Ped Gece Extra Plus 5 Adet;109.90
Nivea Fresh Kadın Deodorant 150 ml ve Roll-on 25 ml Seti;311.90
Herschel Romantic Dream Body Mist 100 ml;499.90
Dalin Kolonya Yaz Esintisi 150 ml;184.90
Signal White System Diş Macunu Güçlü Beyazlık Güçlü Diş Minesi 75 ml;184.90
Kotex Ultra Natural Günlük Ped Normal 28'li;219.90
Rocs Pro 5940 Kıl İçeren Diş Fırçası;379.90
Veet Professional Ağda Bantları Hassas Ciltler İçin Süper Fırsat Paketi 40lı;773.90
Kelebek Harem Krep Kalın Doğal Kese;244.90
Watsons Invisible Fresh 48 Saat Etkili Antiperspirant Kadın Roll-On 50 ml;149.90
Bic Soleil Escape 3 Bıçaklı Lavanta & Okaliptüs 3'lü Paket;299.90
Axe Premium Collection Duş Jeli Copper Santal 3in1 Vücut Saç Yüz 300 ml;299.90
Dalin Klasik Katı Sabun 3x75 g;138.90
Nivea Men Invisible Black and White Fresh Erkek Roll-On 50 ml;311.90
Emotion Serum Boost Cilt Tonu Eşitleyici Deodorant 150 ml;429.90
Colgate Optik Beyaz Pompa Diş Macunu 100 ml;578.90
Kotex Günlük Ped Lightdays Parfümlü 56 Adet;161.90
Epify Papaya Tüy İnceltici Jel 75 ml;939.90
Nivea Men Fresh Sensation Roll on Deodorant 50 ml 72 Saat Anti-perspirant Koruma;311.90
Lapitak Topuk Çatlak Kremi 60 ml;379.90
Dicora Urban Fit Urban Fit Duş Jeli Enerji Vetiver & Ginseng 400 ml;274.90
Watsons Siyah Kulak Çubuğu 200 Adet;209.90
Orkid Günlük Ped Trio Tekli Paket 48 Adet;229.90
Gillette Venus Extra Smooth Swirl Tıraş Makinesi + Yedek Başlık;1037.90
Sesu Hassas Ciltlere Özel Maxi Set Ağda Bandı 40 Adet;449.90
Nivea Men Erkek Banyo ve Duş Jeli Deep Dimension 500 ml Vücut Saç Yüz;489.90
Dove Nemlendirici Duş Jeli Hindistan Cevizi Yağı ve Badem Özü 450 ml;459.90
Colgate Optic White Diş Macun Çay & Kahve & Tütün 50 ml;239.90
Colgate Diş Macunu Hassasiyete Pro Çözüm 75 ml;435.90
Rexona Kadın Sprey Deodorant Invisible Beyaz İz Sarı Leke Karşıtı 72 Saat Kesintisiz Üstün Koruma 200 ml;415.90
Nivea Black and White Invisible Kadın İpeksi Pürüzsüzlük Deodorant 150 ml;311.90
Listerine Cool Mint Ağız Suyu 500 ml;319.90
Mjcare Premıum Nemlendirici Çorap Ayak Maskesi;409.90
Dicora Urban Fit L.A. EDT Kadın 150 ml;1749.90
Blade Deodorant Cool Fresh 150 ml;319.90
Nivea Kadın Sprey Deodorant Pearl&Beauty 150ml ve Mini Roll-on Fresh Natural 25ml, Ter Koruması;289.90
Sensodyne Promine Çocuk Diş Macunu 50 ml;369.90
Sensodyne Promine Kids 0-6 Yaş Çilek & Tatlı Nane Aromalı Çocuk Diş Macunu 50 ml;369.90
Oral-B 3 Boyutlu Beyazlık Şarjlı Diş Fırçası Yedek Başlığı 4'lü;1569.90
Herschel Forever Love Body Mist 150 ml;449.90
Siveno Doğal Roll On Soft Vanilla 50 ml;499.90
Solingen Tırnak Makası 4312;319.90
Deotak Original Kadın Roll-On 35 ml;339.90
Boost & Bliss Body Mist 888 100 ml;449.90
Rocs Orman Meyveli Çocuk Diş Macunu 60 ml;389.90
Le Petit Marseillais Pamuk Sütü Sıvı Sabun 500 ml;209.90
Johnson's Baby Pişik Kremi 100 ml;299.90
Kotex Ultra Hijyenik Ped Ekstra Uzun Gece 9 Adet;315.90
Orkid Günlük Ped İnce Yaprak 100'lü;385.90
Unfilter Beauty Kadın Parfüm EDT Dream Aura 50 ml;499.90
Parodontax Orijinal Diş Macunu 75 ml;279.90
Deotak Fresh Krem Deodorant 35 ml;339.90
Palmolive Feel Glow Duş Jeli 500 ml;329.90
Nivea Men Erkek Roll-On Deodorant Black & White Invisible Güçlü Etki 50 ml;311.90
Deotak Invisible Kadın Roll-On 35 ml;339.90
Watsons Organik Kare Makyaj Pamuğu 50 Adet;64.95
Listerine Diş Eti Bakımı Ağız Suyu Hafif Tat 250 ml;214.90
Watsons Kadın 2 Bıç Kullan At Tıraş Bıçağı 6'lı;249.90
Clinomyn Sigara İçenler İçin Diş Macunu 75 ml;489.90
Rocs Sensations Ekstra Beyazlatıcı Diş Macunu 60 ml;459.90
Kotex Active Quadro Normal 22 Adet;315.90
Watsons Nova Rise Kadın Parfüm EDT 85 ml;1199.90
Balmy Organik Banyo Lifi;259.90
Dove Beauty Cream Bar Original Yumuşak Pürüzsüz Bir Cilt İçin Nemlendirici Krem 90 g;79.95
Axe Premium Cherry Spritz 3In1 Duş Jeli 300 ml;299.90
Oral-B Pro 3D White Clinical Yoğun Beyazlık Parlak Mükemmellik Diş Macunu 75 ml;499.90
Sensodyne Temel Bakım Yumuşak Diş Fırçası;183.90
Molped Supernight Ped Uzun 34 Adet;549.90
Emotion Aqua Kiss Deodorant 150 ml;279.90
Arm&Hammer Advance White Pro Diş Macunu 75 ml;429.90
Rexona Deodorant 150 ml ve Kotex Ped 7 Adet Seti;459.90
Sebamed Bebek Şampuanı 250 ml;519.90
Watsons So Sexy Deodorant Sprey Pudrasız 150 ml;169.90
Watsons Isle Fresh Deodorant Sprey Pudralı 150 ml;169.90
Dicora Urban Fit Duş Jeli Vitamin E Mango ve Avokado 825 ml;499.90
Molped Supernight Süper Gece Super Ekonomik Ped 16 Adet;334.90
Axe Black Erkek Deodorant 150 ml;369.90
Dalin Badem Özlü Kolay Tarama Spreyi 50 ml;114.90
Orkid Platinum Dörtlü Hijyenik Ped Uzun 18'li;378.90
Oral-B 3D White Brilliance Diş Fırçası;269.90
Ulric de Varens Sweet Pomme d'Amour Kadın Parfüm EDP 50 ml;689.90
Colgate Total Beyazlık Diş Macunu Pratik Tasarım Beyazlatıcı 100 ml;400.90
Dicora Urban Fit Nyc Kadın Parfüm EDT 150 ml;1749.90
The Ceel Beyazlatıcı Diş Macunu 75 ml;369.90
Oral-B Pro 3D White Advanced Luxe Glamorous White Diş Macunu 75 ml;172.90
T.O.C Menstrual Kap S;1199.90
Avon Pur Blanca Kadın Parfüm EDT 50 ml;779.90
Nivea Men Erkek Stick Deodorant Fresh Active 50 ml Ter Kokusuna Karşı 48 Saat Koruma;399.90
Watsons Fresh Men Deodorant Sprey Pudrasız 150 ml;169.90
Watsons Tavşanlı Mendil Kutusu 100 Adet;79.95
Nivea Fresh Roll-On 50 ml;311.90
Axe Premium Collection Duş Jeli Aqua Bergamot 3in1 Vücut Saç Yüz 300 ml;299.90
Rexona Üstün Koruma Kadın Roll On Deodorant Shower Fresh 72 Saat Kesintisiz Koruma 50 ml;299.90
Watsons Islak Mendil Yasemin 3x10 Adet;99.95
Axe Premium Black Vanilya 3in1 Duş Jeli 300 ml;299.90
Dove Kadın Sprey Deodorant Nemlendirici Bakım Lotus Çiçeği 150 ml;389.90
Watsons Islak Mendil Elma 3x10 Adet;99.95
Kelebek Harem Yüz Kesesi İpek;129.90
Dove Original Roll On 50 ml;389.90
Colgate Gentle Clean 2+1 Diş Fırçası;225.90
Kelebek Harem İpek Lastikli Banyo Kesesi;214.90
Dove Duş Köpüğü Depply Nourishing 200 ml;599.90
Nivea Fresh Cherry Kadın Roll On 50 ml;311.90
Watsons Yuvarlak Makyaj Pamuğu 100 Adet;44.95
L'Oreal Paris Men Expert Total Clean 5'i 1 Arada Kömürlü Duş Jeli 300 ml;429.90
Duru Fresh Sensations Okyanus Duş Jeli 450 ml;329.90
Parodontax Diş Eti Güçlendirici ve Koruyucu Beyazlatıcı Diş Macunu 75 ml;365.90
Boost & Bliss Body Mist 444 100 ml;449.90
Dove Duş Köpüğü Açai Yağı Yoğun Köpük 200 ml;599.90
Old Spice Bearglove Duş Jeli ve Şampuan 400 ml;378.50
Emotion Natural Breeze Deodorant 150 ml;279.90
Signal Profesyonel Bakım Diş Fırçası Yumuşak 1+1;196.90
Nivea Clear Kadın Deodorant 150 ml ve Roll-on 25 ml Seti;311.90
Gillette Venus Kullan At Tıraş Bıçağı 4'lü Paket;504.90
Gillette Venus Smooth Miami 3'lü Kadın Kullan At Tıraş Bıçağı;763.90
Emotion Deo Kadın Bliss 150 ml;279.90
Molped Pure and Soft Süper Ekonomik Uzun Hijyenik Ped 18 Adet;359.90
Deotak Classic Krem Deodorant 35 ml;339.90
Watsons Love My Softness Mini Cep Mendili Sincap 10x6;59.95
Solingen Tırnak Makası 4318;399.90
Watsons Power Men Deodorant Sprey Pudrasız 150 ml;169.90
Uni Baby Şampuan 900 ml;305.90
Sensodyne Ekstra Beyazlatıcı Diş Macunu 75 ml;239.90
Rexona Men Erkek Sprey Deodorant Invisible Ice Fresh 72 Saat Kesintisiz Üstün Koruma 150 ml;339.90
Garnier Mineral Ultra Kuru Roll-On Deodorant;284.90
Solo Asılabilir Kağıt Havlu;259.90
Palmolive Aroma Sensations So Firm Duş Jeli 500 ml;329.90
Sensodyne Diş Macunu Çok Yönlü Koruyucu ve Ferah Nefes 75 ml;309.90
Axe Africa Deodorant 150 ml;369.90
Le Petit Marseillais Bonheur Duş Jeli Hindistan Cevizi 650 ml;515.90
Listerine Diş Eti Bakımı Ağız Suyu Hafif Tat 500 ml;379.90
Rocs Kids 3-7 Florürsüz Diş Macunu;339.90
Dove Kadın Sprey Deodorant 1/4 Nemlendirici Krem Original 150 ml;389.90
Corega Diş Protez Temizleyici Tablet 30 Adet;219.90
The Ceel Fresh Mint Beyazlatıcı Diş Macunu 75 ml;369.90
Le Petit Marseillais Saf Sıvı Sabun 500 ml;209.90
Uni Islak Mendil Aktif Simple Clean 3x52;169.90
Kotex Active Quadro Uzun 16;315.90
Kotex Ultra Quadro Uzun 18 adet;307.90
Watsons Kremli Duş Jeli Lavanta 1 L;219.90
Colgate Extra Clean Dil Temizleyicili Orta Diş Fırçası 2+1;200.90
Kotex Natural Ultra Double Gece Pedi 10'lu;217.90
Incia Doğal Roll-On Deodorant 50 ml;549.90
Palmolive Body Butter Vanilya Duş Jeli 500 ml;329.90
Oral-B Pro Şarjlı Diş Fırçası + Seyahat Kabı;5059.90
Dalin Avokado Badem ve Zeytinyağlı Bebek Yağı 300 ml;239.90
Dove Sugar Cookie Sıvı Sabun 450 ml;292.90
Natracare Organik Ped Ultra Ekstra Normal 12 Adet;702.90
Emotion Natural Deodorant Bloom 150 ml;279.90
Listerine Ağız Bakım Suyu 250 ml ve Duş Jeli 250 ml Seti;429.90
Dicora Urban Fit Urban Fit Duş Jeli B Vitamini Badem ve Fındık 400 ml;274.90
Colgate Optic White Parıldayan Beyazlık Beyazlatıcı Diş Macunu 75 ml;400.90
Watsons Hankies Mini Whale 6 Adet Mendil;59.95
Eloque Pirinç Doğal Kabak Lifli Sabun 120 g;109.90
Balmy Banyo Lifi Seyahat Seti 3'lü;229.90
Palmolive Soft Essence Hindistan Cevizi Duş Jeli 500 ml;329.90
Banat Klik&Go Seyahat Ağız Bakım Seti;549.90
Palmolive Luminous Oils Macademia Duş Jeli 500 ml;329.90
Le Petit Marseillais Vanilya Sütü Duş Jeli 650 ml;515.90
Rocs Diş Macunu Ultra Beyazlatıcı 94 g;469.90
Watsons Organik Kulak Çubuğu 200 Adet;64.95
Rexona Women Deodorant Roll On Sexy Bouquet 50 ml;299.90
Listerine 6 Etki 1 Arada Ağız Suyu 500 ml;379.90
Listerine Stay White Ağız Suyu 500 ml;379.90
Rocs Black Edition Orta Diş Fırçası;369.90
Enroush Organik Ped Günlük 24'lü;279.90
Axe Premium Collection Erkek Sprey Deodorant Aqua Bergamot 72 Saat Ferahlık 150 ml;487.90
Dalin Kolonya Turunç Bahçesi 150 ml;184.90
Dicora Urban Fit Duş Jeli E Vitamini Mango&Avokado 400 ml;274.90
Watsons Kremli Duş Jeli Çilek 1 L;219.90
Beauty Formulas Mouthrinse Soft Mint Mint Ağız Çalkalama Suyu Alkolsüz 750 ml;289.90
Deotak Soft Krem Deodorant 35 ml;339.90
Ulric de Varens Sweet Coco Soleil Kadın Parfüm EDP 50 ml;689.90
Orkid Ultra Ekstra Dörtlü Hijyenik Ped Normal 24'lü;256.90
Watsons Evening Sun Deodorant Sprey Pudrasız 150 ml;169.90
Enroush Organik Ped Normal 12'li;279.90
Watsons Golden Horizon Deodorant Sprey Pudralı 150 ml;169.90
Beauty Formulas Feminine İntim Temizleme Sıvısı 250 ml;249.90
Oral-B Pro 3DW Advance Ekspres Beyazlatma Diş Macunu 75 ml;359.90
Rebul Mystic Cherry Kadın Parfüm EDP 50 ml;499.90
Superdrug Fruity Şeftali Sorbe Ayak Maskesi 1 Adet;349.90
Dicora Urban Fit Paris Kadın Parfüm EDT 150 ml;1749.90
Colgate Optic White Diş Macun Çay & Kahve & Tütün 75 ml;435.90
Superdrug Fruity Pamuk Şeker Ayak Maskesi 1 Adet;349.90
Parodontax Aktif Diş Eti Onarımı Beyazlatıcı 75 ml;365.90
Kelebek Harem Kalın Siyah Krep Lastikli Kese;214.90
Watsons Tüy Dökücü Krem 100 ml;299.90
Tampax Pearl Compak Tampon Super 16'lı;350.90
Signal White System Diş Macunu Arındırıcı Beyazlık Aktif Karbon 75 ml;184.90
Unfilter Beauty Kadın Parfüm EDT Crystal Heart 50 ml;499.90
Miine Banyo Lifi XL Mor;94.95
Watsons Pearly Glow Kadın Parfüm EDT 85 ml;1199.90
Rocs Uno Hızlı Beyazlatıcı Diş Macunu 74 g;329.90
Dove Beauty Cream Bar Pink Nemlendirici Krem 90 g;79.95
Activex Sıvı Sabun Antibakteriyel Aktif 500 ml;199.90
Smileyes Çikolata Aromalı +6 Yaş Çocuk Diş Macunu;239.90
Zantis Yaşlanma Karşıtı Katı Sabun 80 g;149.00
Sesu Soğuk Ağda Bandı Mini 20 Adet;221.90
Ulric de Varens Sweet Pêche Chantilly Kadın Parfüm EDP 50 ml;689.90
Colgate Max White Mor Diş Macunu 75 ml;194.90
Dove Men Care Sprey Deodorant 1/4 Nemlendirici Krem Clean Comfort 150 ml;389.90
Johnson's Bebek Yağı 500 ml;495.90
Watsons Spiral Diş Fırçası Orta 3 Adet;249.90
Sesu Roll-On Sir Ağda Hassas Ciltler İçin 100 ml;259.90
Pure'n Soft Cotton Ultra İnce Günlük Ped Kokusuz 40'lı;169.90
Dove Sprey Deodorant Passion&Lemongrass 150 ml;389.90
Watsons Super Smooth Nane Diş İpi 50 m;89.95
Imprime Cherie Intense Kadın EDP Parfüm 50 ml;1099.90
Blade Deodorant Marine Fresh 150 ml;319.90
Sesu Soft Sir Ağda Bandı Tüm Vücut 32 Adet;374.90
Dalin Teen Bubble Up Duş Jeli 190 ml;243.90
Rexona Kadın Sprey Deodorant Passion %0 Alüminyum 48 Saat 150 ml;339.90
Dalin Göz Yakmayan Bebek Şampuanı 700 ml;319.90
Watsons El Sabunu Çilek & Yoğurt 500 ml;109.90
Sensodyne Hassas Temizlik Diş Fırçası 1+1;229.90
Watsons Lavanta Kokulu Ayak Deodorantı 150 ml;169.90
Avon Perfect Nonsense EDP Peppery Peaches 50 ml;949.90
Zantis Sabun Akne Karşıtı 80 g;319.90
Orkid Platinum Dörtlü Hijyenik Ped Gece Ekstra 16'lı;378.90
Watsons Doğal İçerikli 48 Saat Etkili Vegan Roll-On Nature 50 ml;229.90
Unfilter Beauty Kadın Parfüm EDT Velvet Moon 50 ml;499.90
Duru Fresh Duş Sabunu Extra Yağmur Ormanı 4x150 g;248.90
Emotion Serum Boost Yatıştırıcı Etki Deodorant 150 ml;429.90
Orkid Platinum Dörtlü Hijyenik Ped Ekstra 16'lı;378.90
Old Spice Whitewater Erkekler İçin Duş Jeli ve Şampuan 1000 ml Ekstra-XL;749.90
Rexona Kadın Sprey Deodorant Invisible Beyaz İz Sarı Leke Karşıtı 72 Saat Kesintisiz Üstün Koruma 150 ml;339.90
Frudia My Orchard Peach Peeling Ayak Maskesi;299.90
Kotex Natural Ped Ultra Double Normal 12'li;217.90
Palmolive Soft Essence Badem Duş Jeli 500 ml;329.90
Signal White Now Extra Fresh Diş Macunu 50 ml;244.90
Dove Men +Care Extra Fresh Duş Jeli 400 ml;349.90
Agiss Hassas Ciltler Tüy Dökücü Krem 100 ml;159.90
Herschel Midnight Passion Body Mist 150 ml;449.90
Colgate Optic White Serum 40 ml;1633.90
Watsons Kremli Duş Jeli Şeftali 1 L;219.90
Dalin Teen Yüz Temizleme Jeli 150 ml;365.90
Pure'n Soft Comfort Ultra İnce Günlük Ped Çiçek 40'lı;169.90
Angie Pistachio Macaroon Vücut Spreyi 250 ml;599.90
Palmolive Aroma Sensations Feel Massage Duş Jeli 750 ml;399.90
Dove Men Clean Comfort Stick Deodorant 50 ml;459.90
Lionesse Ayak Törpüsü 457;219.90
Avon Perfect Nonsense EDP Choco Tuberose 50 ml;949.90
Blade Deodorant Green Dream 150 ml;319.90
Le Petit Marseillais Vanilya Sütü Duş Jeli 400 ml;369.90
Dalan Banyo Sabunu Organik Argan Yağlı 4x150 g;169.90
Watsons Bebek Temizleme Pamuğu 60 Adet;109.90
Angie Fresh Apple Vücut Spreyi 250 ml;599.90
Watsons Super Dense Yumuşak Diş Fırçası 2'li;299.90
Palmolive Aroma Sensations Tangerine Duş Jeli 500ml;329.90
Kotex Active Günlük Ped 32 Adet;119.90
Signal 4D Clean Expert Diş Fırçası 1+1;519.90
Sudocrem Bebek Bakım Kremi 125 g;629.90
Sesu Ağda Bezi 10 M;139.90
Sleepy Natural Hijyenik Ped Mega Normal 46 Adet;289.90
Sensodyne Total Care Gentle Floss Diş İpi 30 m;299.90
Dalin Bebek Yağı Çiçeksi Yumuşaklık 300 ml;239.90
Sensodyne Ferah Nefes Diş Macunu 100 ml;219.90
Kotex Natural Günlük Ped İnce 32 Adet;119.90
Watsons Organik Yuvarlak Makyaj Pamuğu 50 Adet;39.95
Signal White Now Color Correct Diş Macunu 75 ml;492.90
Duru Lotus Çiçeği Perfume Duş Jeli 450 ml;329.90
Dalan Botanica Banyo ve Duş Sabunu Lotus 600 g;184.90
Sensodyne Onarım&Koruma Ekstra Yumuşak Diş Fırçası;264.90
Molped Ultra Anatomik Normal Süper Ekonomik 24 Adet;259.90
Watsons Islak Mendil Limon Otlu 3x10 Adet;99.95
Rexona Üstün Koruma Erkek Roll On Deodorant Invisible 72 Saat Kesintisiz Koruma 50 ml;299.90
Watsons L Tipi Ara Yüz Fırçası 6 Adet 0.8 mm;239.90
Watsons Quick Manicure & Pedicure Peeling 150 ml;349.90
Watsons Golden Spark Kadın Parfüm EDT 85 ml;1199.90
Sleepy Natural Hijyenik Ped Mega Uzun 36 Adet;289.90
Dalin Teen Hydro Boss Şampuan 190 ml;432.90
Watsons Diş Lekesi Temizleyici 1 Adet;109.90
Le Petit Marseillais Men Sedir Ağacı ve Mineral Duş Jeli 400 ml;369.90
Imprime Orenda Kadın Parfüm EDP 50 ml;1099.90
Colgate Interdental Arayüz Fırçası 4 mm;531.90
Palmolive Aroma Sensations So Relaxed Duş Jeli 750 ml;399.90
Watsons 3 Katlı Mini Cep Mendili 10x10 Yaprak;139.90
Sensodyne Diş Fırçası Nourish 1+1;289.90
Avon TTA Love Quartz Kadın Parfüm EDP 50 ml;1579.90
Oral-B Diş Fırçası Yedek Başlığı Cross Action 2 Adet;979.90
Balmy Bebek Banyo Eldiveni;164.90
Emotion Gold Bliss Deodorant 90 ml;279.90
Enroush Organik Ped Süper 10'lu;279.90
Slazenger Activesport Erkek Yeşil Deodorant 150 ml;525.90
White Glo Sarı Leke Karşıtı Mor Diş Macunu;799.90
Old Spice White Water Duş Jeli 400 ml;378.50
Dove Coconut Oil Duş Köpüğü 200 ml;599.90
Superdrug Fruity Karpuz Ayak Maskesi 1 Adet;349.90
Watsons Hankies Mini Parrot 6 Adet Mendil;59.95
Orkid Platinum Hijyenik Ped Uzun Tekli Paket 7 Ped;154.90
Duru Orkide Özlü Perfume Duş Jeli 450 ml;329.90
Parodontax Diş Eti + Hassasiyet Beyazlatıcı Diş Macunu 75 ml;365.90
Kotex Ultra Günlük Ped İnce Parfümlü Ekonomik Paket 34'lü;117.90
Molped Pure and Soft Normal Tekli 8 Adet;155.90
Signal White System Arındırıcı Diş Macunu 75 ml 2'li Set;299.90
Duru Body Scrub Duş Jeli Aqua Kuvars 450 ml;439.90
Boost & Bliss 222 Body Mist 100 ml;449.90
Ulric de Varens Sweet Vanille Framboise Kadın Parfüm Edp 50 ml;689.90
Watsons Kremsi Duş Jeli Çilek Refill 900 ml;199.90
Watsons Islak Mendil Ocean 3x10 Adet;99.95
Orkid Günlük Ped 40'lı Ekstra Uzun;254.90
Orkid Platinum Gece Ekstra Boy 4 10 Adet Hijyenik Ped;252.90
Sleepy Natural Hijyenik Ped Mega Gece 30 Adet;289.90
Oral-B Advanced Hassasiyet Koruması Diş Macunu 75 ml;329.90
Lionesse Büyüteçli Bebek Tırnak Makası;199.90
Ulric de Varens Reve De Varens Kadın Parfüm EDP 100 ml;1499.90
Sensodyne Onarım ve Koruma Diş Macunu 75 ml;399.90
Orkid Yaprak Pamuksu Günlük Ped Deo Fresh 80 Adet Dev Ekonomi Paketi;499.90
Colgate Neo Orta Diş Fırçası;230.90
Unfilter Beauty Kadın Parfüm EDT Golden Mirage 50 ml;499.90
Dalin Teen XLong Hair Şampuan 190 ml;432.90
Sesu Tüy Dökücü Krem Hassas Ciltler 100 gr;294.90
Nivea Men Erkek Stick Deodorant Deep Dimension Aktif Karbon 50 ml;399.90
Dalin Bebek Şampuanı 100 ml;56.95
Sesu Ilık Ağda Turuncu 250 gr;179.90
Palmolive Sleep Duş Jeli 500 ml;329.90
Duru Lux Perfumes Duş Jeli Jasmin ve Amber 450 ml;329.90
Dove Kadın Sprey Deodorant 1/4 Nemlendirici Krem Invisible Dry 150 ml;389.90
Molped Daily Care Light Üçüz Normal 60 Adet;242.90
Neutrogena Ayak Kremi Nasırlaşmış Ayaklar İçin 50 ml;304.90
Molped Supernight Önü Uzun Süper Gece Plus 14'lü;334.90
Listerine Cool Mint Ağız Suyu 250 ml;199.90
Dove Nemlendirici Sıvı Sabun Avokado Yağı Kalendula Özü 450 ml;292.90
Eda Taşpınar Body Mist Vanilla Crunch 200 ml;399.90
Sensodyne Hızlı Rahatlama Dış Fırçası Yumuşak 1+1;321.90
Gillette Venus Bikini Bölgesi Yedek Bıçak 3'lü;1059.90
Kotex Natural Super Tampon 16 Adet;348.90
Colgate Extra Clean Dil Temizleyicili Diş Fırçası Orta 1+1;159.90
Smileyes Kids Meyve Jölesi 3-6 Yaş Çocuk Diş Macun;239.90
Watsons Kremli Duş Jeli Aloevera 1 L;219.90
Watsons Küçük Tırnak Makası;119.90
Dove Men +Care Clean Comfort Duş Jeli 400 ml;349.90
Dalin Teen Pop Rush Duş Jeli 190 ml;243.90
Agiss Tüy Sarartıcı Krem 70 ml + 35 ml;229.90
Ulric de Varens Sweet Rose Mandarine Kadın Deodorant 150 ml;489.90
Dalin Avokado Yağlı Vazelin 100 ml;213.90
Dalan Botanica Banyo ve Duş Sabunu Frezya 600 g;184.90
Superdrug Procare Beyazlatıcı Diş Macunu 75 ml;319.90
Dove Deodorant Spray Eventone 200 ml;479.90
Le Petit Marseillais Men Portakal ve Safran Duş Jeli 400 ml;369.90
Smileyes Baby Ahududulu 0-3 Yaş Bebek Diş Macunu;239.90
Watsons Body Cool Vücut Spreyi 200 ml;199.90
Listerine Advanced Whitening Ağız Suyu 250 ml;214.90
Parodontax Diş Eti Güçlendirici ve Koruyucu Ağız Bakım Suyu 500 ml;275.90
Kotex Hijyenik Ped Bio-Care Quadro Normal 20 Adet;330.90
Bepanthol Baby Pişik Önleyici Merhem 30 gr;324.90
Dalin Kids Kolay Tarama Spreyi 200 ml;322.90
Watsons El Sabunu Şeftali & Shea Butter 500 ml;109.90
Signal White System 75 ml + White Now Lekesiz 50 ml Diş Macunu Seti;358.90
Miine Banyo Lifi L Beyaz;84.95
Veet Pure Tüy Dökücü Krem 100 ml;499.90
Oral-B Pro Junior Çürük Önleyici Koruma Diş Macunu 75 ml;399.90
Johnson's Bebek Kolonyası Dream 100 ml;124.90
Smileyes Kids Cola Jölesi 3-6 Yaş Çocuk Diş Macunu;239.90
Listerine 6 Etki 1 Arada Zero Ağız Suyu 250 ml;214.90
Sensodyne Promine Çocuk Diş Fırçası 3-5 Yaş Timsah;264.90
Nivea Deodorant Stick Black & White Authentic Kadın 50 ml;399.90
Watsons Super Dense Yumuşak Kömür Diş Fırçası 2'li;299.90
Dalin Teen Hydro Boss Saç Kremi 190 ml;432.90
Dalin Klasik Islak Mendil 3 Paket 56 Adet;211.90
Miine Kabak Banyo Eldiven Kese;324.90
Ulric De Varens Sweet Pomme D'Amour Edp 50 ml + 20 ml Set;689.90
Dalan Botanica Banyo ve Duş Sabunu Şakayık 600 g;184.90
Watsons Islak Mendil Fresh 50'li;49.95
Nascita Ayak Törpüsü;344.90
Uni Kolay Tarama Saç Spreyi 200 ml;314.90
Unfilter Beauty Kadın Parfüm EDT Litchi Garden 50 ml;499.90
Dove Beauty Cream Bar Gentle Exfoliating Nemlendirici Krem 90 g;79.95
Listerine Cool Zero Ağız Suyu 250 ml;199.90
Kelebek Ekstra Kalın Renkli Kese;244.90
Eyüp Sabri Tuncer Zeytinyağlı Köpük Sabun Japon Kirazı 500 ml;218.90
Listerine 6 Etki 1 Arada Zero Ağız Suyu 500 ml;379.90
Signal 4D White Expert Tekli Diş Fırçası;348.90
Rexona Vitamin + Bright Kadın Roll On Deodorant Rose Glow 45 ml;379.90
Miine Deniz Aslanı Banyo Pufu;199.90
Listerine 6 Etki 1 Arada Ağız Suyu 250 ml;214.90
Listerine Stay White Ağız Suyu 250 ml;214.90
Watsons Karma Paket Hassas Cilt Ağda Bandı 52 Adet;289.90
Colgate Çürüklere Karşı Koruma Diş Macunu 125 ml;162.90
Sudocrem Bebek Bakım Kremi 60 g;439.90
Sensodyne Promine Aktif Diş Minesi Kalkanı Beyazlık 75 ml;379.90
Parodontax Ağız Suyu Ekstra Ferah 500 ml;275.90
Superdrug Hindistan Cevizi Ayak Maskesi 1 Adet;349.90
Activex Sıvı Sabun Antibakteriyel Hassas 500 ml;199.90
Watsons Ortodontik White Diş Fırçası;109.90
