product-name;product-price
Deoproce Korea UV Yüz Stick Güneş Koruyucu Hafif SPF50+ PA++++ 18 g;1449.90
L'Oreal Paris Yaş Uzmanı Yenileyici Krem Gece 50+ 50 ml;949.90
Nivea Kiraz Çiçeği ve Jojoba Yağı Vücut Losyonu 400 ml Normal ve Kuru Ciltler 24 Saat Nemlendirme;589.90
Maruderm Salisilik Asit Bha Yüz Yıkama Jeli 400 ml;949.90
RoC Zengin İçerikli Sarkma Karşıtı Sıkılaştırıcı Yüz Kremi 50 ml;3199.90
Nivea Q10 Power Kırışıklık Karşıtı SPF 30 Gündüz Yüz Bakım Kremi 50 ml;1019.90
Duaderm %0,1 Retinol Serum 30 ml;1485.90
The Ceel Göz Altı Bakım Kremi 12 ml;639.90
Maruderm Niacinamide %10 Gözenek ve Siyah Nokta Karşıtı Serum 30 ml;699.90
Duaderm Bio Collagen Real Deep Maske 1 Adet;523.90
Maruderm Glikolik Asit %5 Kil Maskesi 100 ml;749.90
Sinoz Arındırıcı Nemlendirici Vücut Peelingi 300 g;699.90
Haruharu Black Rice Hyaluronic Tonik 150 ml;1374.90
Frudia Citrus Aydınlatıcı Krem 55 g;1809.90
SNP Prep Peptaronic Nemlendirici Krem 55 ml;1024.90
Axis-Y Leke Önleyici ve Aydınlatıcı Tonik 125 ml;2299.90
Haruharu Black Rice 10 Hyaluronic Krem 50 ml;1799.90
Nascita Silikon Maske Ve Yüz Yıkama Fırçası;409.90
Watsons Yağ Kontrol Burun Bandı AHA&BHA 10'lu;449.90
Frudia Air Watery 3 Katlı Nemlendirme Etkili Maske 25 ml;134.90
Duaderm Serum Vitamin C 30 ml;1485.90
Duaderm Kolajen Peptid Krem 50 ml;1485.90
Eda Taşpınar Yoğun Bronzluk Güneş Seti SP50+ Vücut Güneş Kremi & Yoğun Bronzlaştırıcı Sprey & Kalıcı Bronzluk Losyonu;1599.90
Nivea Cellular Epigenetics Rejuvenating Yaşlanma Karşıtı Cilt Serumu 30 ml;1349.90
Frudia Pomegranate Besleyici Ve Kırışıklık Karşıtı Krem 55 g;1809.90
Neutrogena Skin Detox Serinletici Peeling Jel Serinletici 150 ml;439.90
Neutrogena Yağ İle Zenginleştirilmiş Losyon 400 ml;659.90
Duaderm Natural Bariyer Krem Koruyucu&Onarıcı 50 ml;1035.90
Garnier C Vitamini Parlak Günlük Yüz Güneş Kremi Görünmez Doku SPF50+ 40 ml;829.90
The Ceel Q10 Peeling Jel 100 ml;531.90
Nivea Aqua Rose Micellar Gül Suyu İçeren Çift Fazlı Makyaj Temizleme Suyu 400 ml;639.90
Nivea Luminous630 Skin Glow Peeling Etkili Tonik 100 ml, Eşit Cilt Tonu;614.90
Duaderm Retinoid Yaş Karşıtı Serum 30 ml;1485.90
Duaderm Lipozom Yüz Temizleme Jeli 200 ml;1335.90
Frudia My Orchard Maske Ahududu 1 Adet;79.95
Duaderm Vegan Collagen Serum 30 ml;1485.90
Nivea Derma Skin Micellar Makyaj Temizleme Suyu 400 ml;679.90
Neutrogena Hydro Boost Jel Vücut Losyonu 400 ml;699.90
Nivea Q10 Kırışıklık Karşıtı Çift Etkili Cilt Serumu 30 ml;1139.90
Celenes Herbal Yüz Stick Güneş Koruyucu SPF50+ 15g;649.90
Frudia Avocado Cica Dudak Balmı 10 ml;519.90
L'Oreal Paris Yaş Uzmanı Kırışıklık Karşıtı Nemlendirici Krem 30+ 50 ml;949.90
L'Oreal Paris Age Perfect Kolajen Yüz Temizleme Jeli 150 ml;599.90
Nivea Sun Çocuk Günlük Koruma Vücut Güneş Koruyucu Losyon 100 ml;1249.90
Maruderm Arındırıcı Toz Peeling 60 g;849.90
Nivea Cellular Expert Lift Doğal Retinol Alternatifi Saf Bakuchiol ve Hyaluronik Asit içeren Gece Kremi 50 ml;1259.90
L'Oreal Paris Revitalift %5 Saf Glikolik Asit Peeling Etkili Tonik;1249.90
Maruderm Gözenek Sıkılaştırıcı Leke Karşıtı Niacinamide %10 Krem 200 ml;799.90
Celenes Somon DNA PDRN Bariyer Güçlendirici & Yenileyici Kapsül Yüz Kremi 50 ml;999.90
Skin401 -%2 Salisilik Asit BHA Arındırıcı, Gözenek Sıkılaştırıcı Siyah Nokta Karşıtı Tonik 200 ml;659.90
Nivea Cellular Expert Filler Yoğun Yaşlanma Karşıtı SPF30 Gündüz Yüz Bakım Kremi 50 ml;969.90
Nivea Cellular Expert Lift Doğal Retinol Alternatifi Saf Bakuchiol ve Hyaluronik Asit içeren Gündüz Kremi 50 ml;1259.90
Krauterhof Anti Selülit Jel 250 ml;974.90
Garnier Nem Bombası Kağıt Göz Maskesi Portakallı 1 Adet;224.90
Vaseline Original Dudak Bakım Kremi ve Dudak Parlatıcısı 4.8 g;389.90
Celenes Thermal Yüz Temizleme Jeli Kuru ve Hassas Ciltler 250 ml;749.90
Mjcare Hydrojel Şeffaflaşan Eriyen Maske 39 g;379.90
Mia Klinika Sivilce ve Akne Karşıtı Kremi 50 ml;759.90
Frudia Blueberry Nemlendirici Yüz Maskesi 1 Adet;134.90
Maruderm Pirinç Suyu Vücut Peelingi 250 ml;599.90
Skin401 Moisture Boost Ultra Nemlendirici Göz Kremi 20 ml;659.90
Frudia Blueberry Nemlendirici Jel Temizleyici 145 ml;549.90
Bade Natural Saf Gül Suyu Nemlendirici ve Ferahlatıcı 100 ml;799.90
Unfilter Beauty Leke Karşıtı Serum 30 ml;499.90
Haruharu Black Rice 10 Hyaluronic Krem 90 ml;2674.90
Vaseline Cocoa Dudak Bakım Kremi ve Dudak Parlatıcısı 4.8 g;389.90
Garnier C Vitamini Parlak Günlük Yüz Güneş Kremi Işıltılı Doku SPF50+ 40 ml;829.90
Nivea Siyah Nokta ve Gözenek Temizleyici T-Bölgesi Bant 4 Adet;309.90
Clasy Care Working Hands El Kremi 100 ml;599.90
Medicube Azelaic Asit Temizleme Köpüğü 120 g;1999.90
Maruderm Yağ Bazlı Temizleyici 200 ml;649.90
Bepanthol 3'lü Set Derma Onarıcı Merhem 30 g + Cilt Bakım Kremi 30 g + Dudak Bakım Kremi 7,5 g;689.90
Frudia Citrus Aydınlatıcı Yüz Maskesi 1 Adet;134.90
Beauty Formulas Niacinamide Hydro Jel Göz Maske 6’ lı;374.90
Naturals By Watsons Sakura Vücut Scrub 200 g;629.90
Nivea Smooth Sensation Nemlendirici El ve Vücut Bakım Kremi 400 ml;499.90
Nivea Aloe Vera Nemlendirici Vücut Losyonu 400 ml;589.90
RoC Yüz Temizleme Köpüğü 150 ml;1599.90
Neutrogena Ultra Thin Blemish Patch Sivilce Bandı 24’lü;549.90
Neutrogena Hızlı Emilen Bakım Kremi 300 ml;329.90
Deoproce Kore Snail Recovery Krem 30 g;1449.90
Sinoz Günlük Kullanım Yüz Güneş Koruyucu Losyon SPF50+ 50 ml;899.90
Ziaja Manuka Akneli Cilt Temizleme Jeli 200 ml;624.90
Collagen By Watsons Hydro Balance Nem Bombasi 50 ml;1399.90
Frudia Green Grape Gözenek Kontrol Mini Krem 10 g;564.90
Ziaja Kirlilik Karşıtı Misel Su Yüz, Göz ve Dudaklar İçin Makyaj Temizleyici 390 ml;694.90
Pure Beauty Kombucha The First Esans 150 ml;1599.90
TARGET PRO BY WATSONS YAŞL KARŞ KON.SERUM 30ML;1499.90
Watsons Çok Yüksek Korumalı Vücut Losyonu Spf50+ 100 ml;149.00
Garnier Saf&Temiz Nemlendiren Temizleyici 250 ml;629.90
RoC Kırışıklık Karşıtı Yüz Güneş Koruyucu SPF50 + 50 ml;2199.90
Ph Lab Collagen Night Cilt Yenileyici Serum 50 ml;886.90
Garnier Micellar C Vitamini Kusursuz Makyaj Temizleme Suyu 400 ml;699.90
Watsons Yüz Yağ Emici Mendil 100'lü;109.90
Nivea Q10 7 Günde Sıkılaştırıcı Bronzlaştırıcı Vücut Bakım Losyonu 400 ml Nemlendirici;839.90
Nivea Soft El Kremi Yoğun Nemlendirici 75 ml;309.90
Sinoz Günlük Kullanım Yüz Stick Güneş Koruyucu SPF50+;899.90
Pure Korean Collagen Maske;74.95
ROUND LAB BIRCH JUICE MASKE 1 ADET;259.90
Pink By Pure Beauty Glow On Aydınlatıcı Yüz Güneş Koruyucu Losyon SPF50+ PA++++ 25 ml;999.90
Neutrogena Hydro Boost Gece Kremi 50 ml;929.90
Skin401 Aydınlatıcı ve Pürüzsüzleştirici Meyve Enzim Jel Maskesi 100 ml;659.90
Carmex Orijinal Dudak Balmı 10 g;539.90
Watsons Yüz Temizleme Yağı 105 ml;259.90
Clasy Care Aloevera Jel Maske 20x10 ml;599.90
Duaderm Bariyer Peptit Sprey Serum 50 ml;1035.90
Naturals By Watsons Sakura Vücut Losyonu 490 ml;749.90
Otacı Botanics+ %100 Doğal Gül Suyu Spreyi;234.90
Pure Beauty Brighten Up Temizleme Köpüğü 125 ml;899.90
Haruharu Centella %5 Niacinamide Aydınlatıcı Krem 40 g;1374.90
Garnier Ambre Solaire Yüz ve Vücut Seyahat Boy Güneş Koruyucu Süt SPF30 50 ml;599.90
Nivea Luminous630 Çatlak Karşıtı Nemlendirici Vücut Yağ Serumu 100 ml;632.90
Haruharu Black Bamboo Mist 80 ml;1479.90
L’Oreal Paris Revitalift Glassy Skin Cam Cilt Görünümü Etkili Nemle Parlaklık Veren Şeffaflaşan Hidrojel Yüz Maskesi;574.90
Garnier Micellar Gül Suyu Kusursuz Makyaj Temizleme & Işıltı 400 ml;699.90
L'Oreal Paris Yaş Uzmanı Kırışıklık Karşıtı Krem Besleyici 60+ 50 ml;949.90
Sinoz No:16 Shimmer Oil 100 ml;899.90
Pure Beauty Yüz Güneş Koruyucu Serum SPF50+ 40 ml;1299.90
Welcos Aloevera Moisture Soothing Gel 150 ml;174.90
Frudia Aydınlatıcı Micro Temizleyici 145 ml;549.90
Maruderm Bakuchiol Krem 50 ml;799.90
Neutrogena Visibly Spf 20 Renew El Kremi 75 ml;331.90
Watsons Çift Fazlı Micellar Su 390 ml;249.90
Frudia Pomegranate Besleyici Mini Krem 10 g;564.90
Mia Klinika Yaşlanma Karşıtı Nemlendirici Hyalüronik Asit ve Kolajen Serum 30 ml;718.90
Siveno %100 Doğal Beyazlatıcı Yüz Kremi 30 ml;799.90
Bepanthol Onarıcı Bakım Merhemi 50 gr;469.90
Sebamed Sun Care SPF 30 UVA Korumalı UVB Filtreli E Vitamini Üçlü Yüksek Koruma Güneş Kremi Sprey 150 ml;1469.90
Eda Taşpınar Yoğun Bronzlaştırıcı Yağ 50 ml;219.90
Mia Klinika Kedili Akne Bandı 1 Adet;541.90
Maruderm Leke Karşıtı Cilt Beyazlatıcı Bakım Kremi 200 ml;799.90
Eda Taşpınar Bronzlaştırıcı Koruyucu Yağ Spf 15 200 ml;699.90
L'Oreal Paris Revitalift Filler Dolgunlaştırıcı Serum Maske;415.90
Skin401 -%5 Glikolik Asit Aydınlatıcı Etkili & Leke Karşıtı Tonik Tonik 200 ml;659.90
Watsons Silikon Yüz Pedi;179.90
Medicube Zero Pore Soğutucu Maske 1 Adet;499.90
Maruderm SPF+50 Cica Yüz Güneş Kremi 50 ml;799.90
Maruderm Aydınlatıcı C Vitamini ve Peptid Cilt Bakım Serumu 30 ml;699.90
Ph Lab Collagen Night Temizleme Bar 50 ml;879.90
Nivea Yatıştırıcı Yüz Temizleme Köpüğü Kuru ve Hassas Cilt 150 ml;404.90
Nivea Yenileyici Micellar Makyaj Temizleme Suyu 400 ml;679.90
Nivea Luminous630 Leke ve İz Karşıtı Nemlendirici Vücut Bakım Kremi 200 ml;549.90
Mia Klinika Bentonitli Pembe Kil Maskesi 15 ml;185.90
Watsons Vücut Vücut Güneş Kremi Sprey SPF30 150 ml;769.90
Nivea Canlandırıcı Yüz Temizleme Köpüğü Karma ve Normal Cilt 150 ml;404.90
The Purest Solutions Refill Temizleme Jeli Nemlendirici 400 ml;999.90
Watsons Glow Me Up Yüz Stick Güneş Koruyucu SPF50 20 g;839.90
Collagen By Watsons Moisturising Göz Roll On 15 ml;749.90
D'Feys Aydınlatıcı ve Canlandırıcı C Vitamin Serum 30 ml;663.90
Derminix Yüz Vücut Güneş Kremi Sprey SPF50+ 75 ml;599.90
Pure Beauty Youth Restore Milky Mist 100 ml;1299.90
Nivea Doğal Retinol Alternatifi Bakuchiol Cilt Bakım Serumu Cellular Expert Lift 30 ml;1419.90
Skinfood Egg White Pore Yüz Bakım Maskesi;799.90
Vaseline Gluta Hya Serum Etkili UV Losyon Leke Karşıtı ve Aydınlatıcı 200 ml;619.90
Garnier Salisilik Clinical Sivilce Karşıtı Serum 30 ml;934.90
Eda Taşpınar Doğal At Kılı Fırçası;594.90
Neutrogena Lip Moisturizer Dudak Balmı;239.90
Axis-Y Akne ve Gözenek Karşıtı Serum 15 ml;1399.90
Watsons Yüz Temizleme Yağı 300 ml;479.90
Pure Beauty Youth Restore Sıkılaştırıcı Göz Krem 15 ml;999.90
SHE VEC RICE RICE BABY AYDINLATICI TONİK 200ML;1149.90
Acqua Perfection Collagen Wrapping Mask Kolajen Soyulabilen Cilt Bakım Maskesi 70 ml;399.00
Bepanthol Derma Yüz Temizleme Jeli Arındırıcı ve Canlandırıcı 200 ml;599.90
Nivea Dudak Bakım Kremi ve Parlatıcısı Kiraz 4,8 g 24 Saat Nem;374.90
Cire Aseptine Bronzlaştırıcı Güneş Yağı 90 ml;249.90
RoC 3’ü 1 Arada Makyaj Çıkarma Sütü 400 ml;1999.90
Garnier C Vitamini Süper Aydınlatıcı Gece Serumu 30 ml;999.90
NIVEA SUN ÇOCUK KOR&BAKIM GÜN.LOSYON SPF50 150ML;1629.90
Mjcare 8'li Yüz Maskesi ve Burun Bandı Seti;349.90
Skin401 %0.3 Retinol Serum 30 ml;706.90
Bepanthol Cilt Bakım Kremi 50 gr;469.90
Mjcare Soyulan El Peeling Maske 18 g;329.90
Nivea Cocoa Butter El Ve Vücut Bakım Kremi 400 ml Kuru Ciltler için 72 Saat Nemlendirici;499.90
The Purest Solutions Meyve Asitli Toz Temizleyici 55 gr;819.90
Pure Beauty Youth Restore Contour Perfect Serum 15 ml;1299.90
Nivea Cellular Epigenetics Rejuvenating Yaşlanma Karşıtı Cilt Serumu 15 ml;879.90
Neutrogena Yoğun Nemlendirici Bakım Kremi 300 ml;329.90
Sebamed Q-10 Krem 50 ml;1402.90
Neutrogena Hydro Boost Ultra Nemlendirici Serum 30 ml;929.90
Nivea Besleyici Yüz Kremi 100 ml 24 Saat Nemlendirici;599.90
Watsons Güneş Sonrası Aloe Vera Vücut Jeli 100 ml;59.95
Vaseline Gluta-Hya Serum Etkili Vücut Losyonu Sıkılaştırıcı 200 ml;669.90
Nivea Dudak Bakım Kremi ve Dudak Parlatıcı Çilek 4,8 g 24 Saat Nem;374.90
Garnier Hyaluronik Aloe Micellar Kusursuz Makyaj Temizleme Suyu 400 ml;699.90
Nivea Derma Skin Clear Sivilce Karşıtı Tonik 200 ml;439.90
Pink By Pure Beauty Bye Bye Pores Peeling Pad 70'li;999.90
Watsons Micellar Arındırıcı Tonik 200 ml;379.90
Banila Co Hello Sunny Yüz Stick Güneş Koruyucu SPF50+ PA++++ 18g;2099.90
Unfilter Beauty Peeling Serum 30 ml;499.90
Nivea Nemlendirici Vücut Bakım Losyonu Cocoa Butter 200 ml;369.90
Arko Krem Yağlı 20 cc;75.95
Watsons Aloe Vera Jel 150 ml;339.90
Neutrogena Collagen Bank Jel Göz Kremi 30 ml;1159.90
Sinoz No: 16 Mucizevi Bakım Yağı 100 ml;799.90
Ziaja Zeytinyağlı Vücut Losyonu 400 ml;499.90
Vaseline Gluta Hya Serum Etkili Losyon Canlandırıcı Parlaklık 200 ml;619.90
Neutrogena Temizleme Mendili 25 Adet;319.90
Celenes Herbal Renkli Yüz Güneş Kremi SPF50+ PA++++ 50 ml Light;829.90
Mia Klinika Yaşlanma Karşıtı Bariyer Onarıcı Serum 30 ml;718.90
Celenes Herbal Yüz Güneş Kremi Kuru ve Hassas Ciltler SPF50+ PA++++ 50 ml;829.90
Pure Beauty Ci-Care Leke Karşıtı Serum 30 ml;1199.90
Frudia Pomegranate Besleyici Yüz Maskesi 1 Adet;134.90
Luvum Calming Repair Cica Şeffaflaşan Jel Maske 33 g;479.90
Arko Nem Değerli Yağlar El ve Vücut Krem Avokado 250 ml;249.90
Pure Beauty Ci-Care Yüz Kremi 50 ml;1199.90
TARGET PRO BY WATSONS NEMLENDİRC KON. SERUM 30ML;1499.90
Watsons Tone Up Yüz Güneş Kremi SPF50+ 50 ml;939.90
Celenes Sea BuckThorn Yüz Bakım Kremi Dengeleyici Yağlı ve Karma Ciltler 50 ml;749.90
Skin401 Pirinç Özü Nemlendirici İpeksi Krem 50 ml;659.90
Good Sense Tiger Niacinamide Kağıt Yüz Maskesi;56.95
Sinoz Cica Ton Eşitleyici Onarıcı Bakım Krem 15 ml;799.90
Skin Sensual Jojoba Oil Shea Butter 24 Saat Etkili Nemlendirici 50 ml;749.90
Pink By Pure Beauty Glow On Işıltı Veren Nemlendirici Güneş Koruyucu Losyon SPF50+ PA++++ 50 ml;1129.90
Matsu Marine Algae Yüz Temizleme Balm 100 ml;639.90
Bebak Bacak ve Vücut Fondöteni Extra Light Açık 0 Numara 75 ml;549.90
Neutrogena Yoğun Nemlendirici Vücut Losyonu 250 ml;394.90
BANOBAGI BABY FACE BOOSTER MASKE 1AD;249.90
Mjcare Aydınlatıcı ve Nemlendirici Göz Maskesi 9 g;143.90
L'Oreal Paris Elseve Hydra [Hyaluronic] Pure Salisilik Asit içeren Yağlanma Karşıtı Nemlendirici Saç Kremi 250 ml;419.90
Target Pro By Watsons Age Defense Yaşlanma Karşıtı Serum 30 ml;1499.90
Watsons Bronzlaştırıcı Sprey Hindistan Cevizi 150 ml;499.90
Garnier Nem Bombası Kağıt Maske Nar Özü;239.90
Skin Sensual Deep & Soothing Temizleme Yağı 200 ml;699.90
Ziaja C Vitamini B3 Niacinamide Yüz Toniği 190 ml;549.90
Neutrogena Visibly Clear Yağsız Nemlendirici 50 ml;424.90
Neutrogena Hızlı Emilen El Kremi 75 ml;182.90
Duaderm Natural Yüz ve Vücut Güneş Kremi Sprey SPF50 75 ml;899.90
Frudia Blueberry Nemlendirici Hafif Yapılı Yüz Güneş Kremi SPF50 PA++++ 50g;949.90
Skin401 50+ SPF Pembe Ton Eşitleyici Yüz Güneş Kremi 50 ml;649.90
Maruderm Leke Karşıtı Cilt Bakım Serumu 30 ml;149.00
Garnier 2 Milyon Probiyotik Türevi İçeren Onarıcı Kağıt Yüz Maskesi;239.90
Nivea Soft Nemlendirici Bakım Kremi Yüz Vücut El 300 ml Jojoba Yağı ve E Vitamini Tüm Ciltler;359.90
Frudia My Orchard Maske Şeftali 1 Adet;79.95
Beauty Formulas Hyalronic Hydro Jel Göz Maskesi 6'lı;374.90
Garnier C Vitamini Right Aydınlatıcı Nemlendirici Sorbe Yüz Kremi 85 ml;649.90
Pure Korean Akne Sivilce Spot Patch;99.95
Ice Queen Hyaluronic Matrix Masaj Uçlu Krem 80 ml;959.90
Pure Korean Cooling Göz Maskesi;229.90
Pure Beauty Niacin-Gluta Brighten Up Maske 20 ml;199.90
Acqua Perfection Multi Vitamin C B5 B3 Cilt Aydınlatıcı ve Leke Karşıtı Soyulabilir Yüz Maskesi 70 ml;399.00
Ziaja Keçi Sütü Enzimatik Yüz Ve Boyun Peeling 75 ml;149.00
Dalan Onarıcı Yoğun Bakım Kremi 20 ml;54.95
Bepanthol Tattoo Dövme Bakım Merhemi 50 g;469.90
Ice Queen Niacinamide Masaj Uçlu Krem 40 ml;689.90
Nivea El Kremi Koruyucu Bakım 75 ml;229.90
Otacı Botanics+ Canlandırıcı Yüz Temizleme Köpüğü 150 ml;689.90
Neutrogena Visibly Renew Vücut Losyonu Kuru Cilt 400 ml;699.90
Medicube Kolajen Glow Booster Shot Serum 15 ml;3299.90
Garnier Nem Bombası Ferahlatıcı Kağıt Yüz Maskesi Yeşil Çay Özü;239.90
Frudia Pomegranate Besleyici Ve Kırışıklık Karşıtı Jel Temizleyici 145 ml;549.90
Frudia Blueberry Nemlendirici Serum 50 g;1624.90
Pure Beauty Brighten Up Niacinamide-Glutathione Luminous Serum 30 ml;999.90
Nivea Besleyici Makyaj Temizleme Mendilleri Kuru Cilt 25 Adet;359.90
Nivea SPF15 Super10 Serum Etkili Sıkılaştırıcı ve Aydınlatıcı Vücut Losyonu 170 ml;599.90
Nivea Q10 SPF50 Gündüz Yüz Bakım Koruyucu 40 ml Kırışıklık Karşıtı;1019.90
Banila Co Clean It Zero Yağ Bazlı Yüz Temizleyici Balm Pore Kontrol Mini 50 ml;1249.90
Skin401 Yatıştırıcı ve Onarıcı Cica Krem 50 ml;659.90
Pure Beauty Cica Soothe Maske 20 ml;199.90
Neutrogena Visibly Clear Siyah Nokta Temizleyici Tonik 200 ml;424.90
Maruderm Kahve & Yeşil Çay Vücut Peelingi 250 ml;599.90
Vaseline Lipstick Mint Etkili 4.8 g;389.90
Naturals By Watsons Sakura El Kremi 30 ml;249.90
SNP Prep Vitaronic Aydınlatıcı Maske 25 ml;134.90
Pure Korean Kolajen Göz Altı Maskesi;99.95
Banila Co Clean It Zero Yağ Bazlı Yüz Temizleyici Balm Orijinal Powerpuff 100 ml;1749.90
SNP COLLAGEN BOUNCE UP HYPERACTIVE GEL MASK 25 ML;399.90
Skin401 Nemlendirici Yüz Temizleme Jeli 200 ml;563.90
Frudia My Orchard El Kremi Şeftali 30 g;224.90
Duaderm Hassas Ciltler Nemlendirici Tonik 200 ml;1334.90
Vaseline Vücut Losyonu Temel Onarım Kuru Ciltler İçin 200 ml;399.90
Watsons Derinlemesine Temizlik Burun Bandı Charcoal Powder 10'lu;449.90
L'Oreal Paris Bright Reveal Koyu Leke Karşıtı Serum 10%Niasinamid 30 ml Sivilce, Güneş, Yaşlanma Lekelerinde Etkili;1469.90
PURE KOREAN BAKUCHIOL MASKE;84.95
Sinoz Avocado Bomb Nemlendirici Yüz Kremi 50 ml;899.90
Mjcare Arbutin Özlü Yüz Maskesi 22 g;89.95
Frudia Grape Honey Renkli Dudak Yağı 10g;439.90
Mia Klinika Leke Karşıtı Mikro İğneli Akne Bandı 6 Adet;574.90
Bebak Bacak ve Vücut Fondöteni 2 Numara Medium 75 ml;549.90
Nivea Dudak Bakım Kremi Hydro Care 4,8 g 24 Saat Nem SPF 15;374.90
Maruderm Retinol %0.3 Yaşlanma Karşıtı Gece Kremi 50 ml;799.90
Mia Klinika Sivilce Karşıtı Arındırıcı Salisilik Asitli Kil Maskesi 25 g;454.90
Sinoz Cica Onarıcı Bakım Kremi 50 ml;759.90
Ziaja Acai Meyvesi Özlü Micellar Yüz Temizleme Jeli 200 ml;554.90
Watsons Parfümlü Vazelin 100 ml;109.90
Watsons Vazelin Orijinal 100 ml;109.90
Agiva Nemleyici Besleyici Vücut Losyonu Çilek 300 ml;420.90
Frudia My Orchard El Kremi Çarkıfelek 30 g;224.90
L'Oreal Paris Yaş Uzmanı Sıkılaştırıcı Krem Gece 40+50 ml;949.90
Celenes Somon DNA PDRN Gözenek Sıkılaştırıcı & Cilt Tonu Eşitleyici Tonik 200 ml;749.90
Mia Klinika SPF50+ Pink Tone Up Ton Eşitleyici Pembe Yüz Güneş Kremi 50 ml;787.90
HARUHARU B. BAMBOO STICK GÜNEŞ KREMİ SPF50+ 20GR;1874.90
Mia Klinika Retinol ve Kolajen İçeren Yaşlanma Karşıtı Krem 50 ml;759.90
Pastellab. Lip Sleeping Mask Dudak Bakım Maskesi Peach;459.90
Nivea Dudak Bakım Kremi Med Repair 4,8 g 24 Saat Nem SPF15;374.90
Dalan D'Olive Vücut Onarıcı Bakım Yağı 200 ml;249.90
Celenes Herbal Bronzlaştırıcı Güneş Yağı Spf15+ 200 ml;549.90
Neutrogena Sivilce Karşıtı Temizleme Jeli 200 ml;559.90
Neutrogena Dudak Nemlendirici Lipstick;239.90
BANOBAGI SILK PEARL BOOSTER MASKE 1AD;299.90
Mia Klinika Gözenek Sıkılaştırıcı Tonik 200 ml;675.90
Skin401 Arındırıcı Sülfür & Kömür Maskesi 75 ml;666.90
Maruderm Avokado Kırışıklık Karşıtı, Nemlendirici Ve Aydınlatıcı Göz Çevresi Kremi 15 ml;749.90
Good Sense Panda Collagen Yüz Maskesi;56.95
Watsons El ve Vücut Kremi Majesty 250 ml;129.90
Ice Queen Niacinamide Kafein Göz Kremi 15 ml;499.90
Revolution Jelly Candy Ice Pink Dudak Yağı;659.90
Ziaja Acai Meyvesi Özlü Tonik 200 ml;554.90
Frudia Blueberry Nemlendirici Tonik 195 ml;1189.90
Nivea Canlandırıcı ve Nemlendirici Tonik 200 ml;354.90
Frudia Blueberry Nemlendirici Mini Krem 10 g;564.90
Nivea Luminous630 Skin Glow Parlaklık Etkili Serum İçerikli Micellar Makyaj Temizleme Suyu 400 ml;679.90
Nivea Micellar Canlandırıcı Makyaj Temizleme Suyu Normal Ciltler 400 ml;539.90
Watsons El ve Vücut Kremi Royal 250 ml;129.90
Vaseline Nemlendirici Jel Baby 100 ml;342.90
Skin401 Pirinç Özü Yüz Temizleme Jeli 200 ml;582.90
Banila Co Clean It Zero Yağ Bazlı Yüz Temizleyici Balm Gözenek Kontrol Snoopy 100 ml Charm Hediyeli;2699.90
Vaseline Nemlendirici Jel Cocoa Butter 100 ml;342.90
Celenes Thermal Arındırıcı Canlandırıcı Tonik 200 ml;619.90
Neutrogena Hydro Boost Konsantre Nemlendirici Krem 50 ml Yoğun Yüz Kremi;929.90
Sinoz Hydrapro Nemlendirici Yüz Kremi 50 ml;699.90
LOREAL PARIS REVITALIFT VİT C PEELİNG TONİK 180ML;959.90
Celenes Somon DNA PDRN Onarıcı & Yenileyici Active Serum 30 ml;999.90
L'Oreal Paris Bright Reveal Renkli Yüz Güneş Kremi SPF50+ 50 ml Light Koyu Leke Karşıtı;1359.90
TARGET PRO BY WATSONS GÖZENEK BKM KON. SERUM 30ML;1499.90
Duaderm Intense Repair Ozonize Cilt Bakım Serumu 50 ml;1484.90
Good Sense Rabbit Ceramide Kağıt Yüz Maskesi;56.95
Watsons Bronzlaştırıcı Sprey Kakao Yağı 150 ml;499.90
Vaseline Vücut Losyonu Hassas Bakım Kuru Çok Kuru ve Hassas Ciltler İçin 200 ml;399.90
SNP Skin Return Lifting Essence Maske;159.90
Celenes Cloudberry Yatıştırıcı Yüz Bakım Kremi Kuru ve Hassas Ciltler 50 ml;749.90
SNP Skin Return Soothing Essence Maske;159.90
Maruderm Yaşlanma Karşıtı Kolajen ve Hyaluronic Asit Cilt Bakım Serumu 30 ml;699.90
Skin Sensual Vita-C Ton Eşitleyici Serum 30 ml;749.90
Celenes Aqua Thermal Nemlendirici Sprey 150 ml;469.90
Neutrogena Hydro Boost Water Jel Temizleyici Parfümsüz 200 ml;539.90
Bio-Oil Cilt Bakım Yağı 125 ml;1081.90
SNP Prep Cicaronic Yatıştırıcı Maske 20 ml;134.90
L'Oreal Paris Collagen Expert Yaşlanma Karşıtı Serum 30 ml;879.90
The Purest Solutions Microneedle Akne Patch 9 Adet;749.90
Derminix Güneş Yağı Kakao 125 ml;299.90
Arko Nem Değerli Yağlar El ve Vücut Krem Zeytinyağlı 250 ml;249.90
Watsons Glow Whiten Tonik Ped 30 Adet;369.90
Watsons Siyah Nokta Komedon Temizleyici İğne;99.95
Watsons Cicare Pro+ Yatıştırıcı Maske 30 ml;169.90
The Ceel Vitamin C Serum 30 ml;612.90
Arko Nem Değerli Yağlar Avokado El ve Vücut Kremi 60 ml;149.90
Garnier Dudak Nemlendirici Bakım Maskesi;224.90
Maruderm SPF+ 50 Pembe Ton Eşitleyici Yüz Güneş Kremi 50 ml;799.90
Pink By Pure Beauty Glow On Milky Tonik 100 ml;999.90
Haruharu Centella Sunflower Temizleyici Balm 100 g;1749.90
Pure Beauty Ceramoist Kağıt Maske 20 ml;199.90
Nivea Yatıştırıcı ve Nemlendirici El Bakım Kremi Aloe Vera 75 ml;229.90
Zhene V-Lift Pro Yüz Germe Bandı 40 Adet;199.90
Neutrogena El Kremi Parfümlü 75 ml;229.90
PURE BEAUTY CI-CARE TONİK PED 60'LI;1699.90
Neutrogena Skin Detox 3 Etkili Micellar Water 400 ml;449.90
Sinoz Yağlı ve Karma Ciltler Yüz Temizleme Jeli 400 ml;899.90
SNP Skin Return Water Essence Maske;159.90
Garnier Kağıt Maske C Vitamini Parlaklık Verici 1 Adet;239.90
Bilge Öztürk Buz Jel 125 ml;79.95
Sinoz Pink Touch Ton Eşitleyici Yüz Güneş Kremi SPF50 50 ml;799.90
Carmex Vişne Dudak Balmı 10 g;539.90
Collagen By Watsons Youth Secret Gündüz Kremi 50 ml;1299.90
BANOBAGI VITA GENIC JELLY MASKE LIFTING 1AD;199.90
Maruderm SPF+50 Mineral Filtre Yüz Güneş Kremi 50 ml;799.90
Vaseline Rosy Dudak Bakım Kremi ve Dudak Parlatıcısı 4.8 g;389.90
Skin401 Kalendula Özlü Yüz Temizleme Yağı 200 ml;658.90
Garnier C Vitamini Parlak Günlük Aydınlatıcı Nemlendirici Krem 50ml;465.90
Frudia My Orchard El Kremi Shea Yağı 30g;224.90
SNP Prep Vitaronic Ampul Maske 25 ml;134.90
Nivea Luminous630 Sivilce Lekesi Karşıtı Serum 30 ml Salisilik ve Hyaluronik Asit;1299.90
Neutrogena Ultra Sheer Yaşlanma Karşıtı SPF50 Yüz Güneş Kremi 50 ml;899.90
BANILA CO CLEAN IT ZERO MINI BALM SET 4X7ML;799.90
Gülbirlik Güllsuyu Sprey 125 ml;239.90
Collagen By Watsons Moisturising Tonik 150 ml;629.90
Frudia Citrus Vitamin C Aydınlatıcı Toning Ped 2 Adet;84.95
Nivea Kırmızı Renkli Nemlendirici Allık Etkili Dudak Bakım Kremi 4.8 g;439.90
Bepanthol Dudak Bakım Kremi 7,5 ml;299.90
Neutrogena Collagen Bank Nemlendirici Gece Kremi 50 ml;1159.90
Watsons Fruity Aloe Vera Işıltı Veren Maske 30 ml;149.90
Neutrogena Collagen Bank Nemlendirici Gündüz Kremi SPF30 50 ml;1159.90
Arko Nem Gliserinli El Kremi 60 ml;149.90
Neutrogena Ultra Sheer Yağlanma Karşıtı SPF50+ Yüz Güneş Kremi 50 ml;899.90
Ziaja Manuka Akneli Cilt Peelingi 75 ml;489.90
Watsons Fruity Salatalık Ferahlatıcı Maske 30 ml;149.90
Arko Nem Soft Touch Nemlendirici Bakım Kremi 60 ml;149.90
Watsons Organik Micellar Temizleme Suyu 390 ml;259.90
The Purest Solutions Refill Gözenek Sıkılaştırıcı Tonik 400 ml;999.90
Frudia What's Wrong Ac Clear Arındıcı Ped 2 Adet;84.95
Celenes Thermal Micellar Temizleme Suyu Yağlı ve Karma Ciltler 400 ml;519.90
Neutrogena Hızlı Emilen Vücut Spreyi 200 ml;519.90
Pure Korean Snail Maske;74.95
Naturals By Watsons Argan Vücut Losyonu 490 ml;749.90
Nivea Body Besleyici Vücut Sütü 200 ml;369.90
Carmex Stick Dudak Balmı Klasik Spf15 4.25 g;539.90
Nivea Yatıştırıcı Micellar Makyaj Temizleme Suyu 400 ml + Böğürtlen Nemlendirici Dudak Bakım Kremi 4,8 g Set;824.90
Cire Aseptine Vazelin Gül 150 ml;189.90
Garnier Saf & Temiz Yağlanma ve Pürüzlere Karşı 3'ü 1 Arada 150 ml;799.90
Pure Korean Hyalüronik Asit Göz Altı Maskesi;99.95
