product-name;product-price
Nyx Professional Makeup Bare With Me Kapatıcı Serum 02 Light;1499.90
L'Oreal Paris Telescopic Maskara Gold Black;1449.90
Nyx Professional Makeup Bare With Me Kapatıcı Serum 01 Fair;1499.90
Maybelline New York Lash Sensational Maskara Sky High;1699.90
Maybelline New York Vinyl Ink Ruj Peachy No: 15;1599.90
Revolution Forever Flawless Far Paleti Bird of Paradise;1499.90
Revolution Forever Flawless Far Paleti Affinity;1499.90
Nyx Professional Makeup Ultimate Shadow Palette Warm Neutrals Göz Farı Paleti;2399.90
Maybelline New York Super Stay Vinyl Ink Likit Parlak Ruj 130 Extra;1599.90
Nyx Professional Makeup Face Glue Makyaj Bazı;829.90
L'Oreal Paris Panorama Hacim Veren Maskara Siyah;1799.90
Maybelline New York Super Stay Vinyl Ink Likit Parlak Ruj 120 Punchy;1599.90
Maybelline New York Vinyl Ink Ruj Lippy No: 10;1599.90
L'Oreal Paris Glotion All-In-One Doğal Işıltı 903 Medium Glow;1499.90
Maybelline New York Super Lock Brow Glue Kaş Sabitleyici Maskara;1299.90
Maybelline New York Serum Etkili Hyaluronik Asit ve Besleyici Yağ İçeren Ruj Satin Upstate 101;1049.90
Maybelline New York Super Stay Vinyl Ink Likit Parlak Ruj 115 Peppy;1599.90
Maybelline New York Super Lock Brow Glue Kaş Sabitleyici Maskara Taupe;1299.90
Maybelline New York Instant Anti-Age Colour Correct Green;1399.90
Nyx Professional Makeup Buttermelt Blush Kremsi Pudra Allık 09 Feelin Butta;1149.90
Nyx Professional Makeup The Face Glue Sabitleyici Sprey;829.90
Maybelline New York Super Lock Brow Glue Kaş Sabitleyici Maskara Medium Brown;1299.90
Maybelline New York Lash Sensational Yelpaze Etkili Maskara Ekstra Siyah;1349.90
L'Oreal Paris Panorama Chromatic Maskara Bordo;1799.90
L'Oreal Paris True Match Fondöten No: 1N;1699.90
Nyx Professional Makeup Bare With Me Kapatıcı Serum 03 Vanilla;1499.90
Maybelline New York Lash Sensational Sky High Kahverengi Maskara;1699.90
Nyx Professional Makeup Epic Ink Liner Siyah;1049.90
Maybelline New York Vinyl Ink Ruj Cheeky No: 35;1599.90
Nyx Professional Makeup Brow Glue Kaş Sabitleyici Maskara Şeffaf;1099.90
Flormar Volume Up Yüksek Pigmentli & Hacim Etkili Kat Kat Uygulanabilir Maskara;1249.90
Revolution The Icon Enchanted Far Paleti;1809.90
Nyx Professional Makeup Buttermelt Blush Kremsi Pudra Allık 04 U Know Butta;1149.90
L'Oreal Paris Telescopic Extensionist Maskara;2119.90
Nyx Professional Makeup Buttermelt Blush Kremsi Pudra Allık 08 Getting Butta;1149.90
Maybelline New York Instant Anti Age Eraser Kapatıcı 01 Light;1399.90
Maybelline New York Lash Sensational Yelpaze Etkili Maskara Siyah;1349.90
L'Oreal Paris Telescopic Carbon Siyah Maskara;1999.90
Flormar Extreme Tattoo Suya Dayanıklı ve Kalıcı Jel Göz Kalemi Koyu Kahve;799.90
Flormar Extreme Tattoo Yoğun Pigmentli Işıltılı Jel Göz Kalemi No: 001 Glitzy Brown;799.90
Nyx Professional Makeup Wonder Snatch Sabitleyici Pudra Sugar Serve;849.90
L'Oreal Paris Panorama Chromatic Maskara Brun Leather;1799.90
Flormar Sheer Up Ruj No: 013 Gaia;869.90
L'Oreal Paris Infaillible 24H Kapatıcı 322;1799.90
Unfilter Beauty Lip & Cheek 41 Cheeked;349.90
Revolution Ultra Blush Palette Sugar and Spice;999.90
Nyx Professional Makeup Epic Ink Liner Dark Chocolate;1049.90
Nyx Professional Makeup Buttermelt Highlighter Kremsi Pudra Aydınlatıcı 05 Bright And Butta;1149.90
Maybelline New York Instant Eraser Anti Age Kapatıcı No: 00 Ivory;1399.90
Note 3in1 Glowing Skin Tinted Nemlendirici;949.90
Revolution The Icon True Bronze Far Paleti;1809.90
L'Oreal Paris True Match Bakım Yapan Fondöten 3N Nötr Alt Ton;1699.90
L'Oreal Paris Infaillible 3-Second Makyaj Sabitleme Spreyi;1279.90
Maybelline New York Sky High Maskara Cosmic Black;1699.90
L'Oreal Paris True Match Fondöten 3D3W Bej Dore;1699.90
Nyx Professional Makeup Buttermelt Blush Kremsi Pudra Allık 02 Butta Together;1149.90
Nyx Professional Makeup Wonder Snatch Sabitleyici Pudra Cheeky Cherry;849.90
Nyx Professional Makeup Aydınlatıcı & Kontür Pro Paleti;2549.90
Maybelline New York Lash Sensational Sky High Suya Dayanıklı Waterproof Maskara;1699.90
Nyx Professional Makeup Make em Wonder Fondöten 08 Vanilla;999.90
Nyx Professional Makeup Buttermelt Blush Kremsi Pudra Allık 01 My Butta Half;1149.90
Maybelline New York Instant Anti Age Eraser Kapatıcı No: 03 Fair;1399.90
Revolution Reloaded Far Paleti Iconic Fever;934.90
Revolution Reloaded Far Paleti Velvet Rose;934.90
Nyx Professional Makeup Slim Lip Kalem Nude Truffle;899.90
Revolution Reloaded Aydınlatıcı Just My Type;749.90
Flormar Longer Than Ever Uzun Görünüm Veren Maskara No: 001;1249.90
Maybelline New York Instant Anti Age Eraser Kapatıcı No: 02 Nude;1399.90
Golden Rose Max Hold Brow Glue Şeffaf Kaş Sabitleyici;504.90
Maybelline New York Lash Sensational Yelpaze Etkili Suya Dayanıklı Maskara Siyah;1349.90
Revolution Reloaded Palette Affection Far Paleti;934.90
Flormar Sheer Up Ruj No: 003 Pinky Nude;869.90
Maybelline New York The Blushed Nudes Far Paleti;1799.90
Nyx Professional Makeup Buttermelt Bronzer 03 Deserve Butta;1149.90
Nyx Professional Makeup Buttermelt Bronzer 02 All Buttad Up;1149.90
Revolution Maxi Reloaded Nudes Far Paleti Ultimate;1999.90
Maybelline New York Sky High Burgundy Haze Maskara;1699.90
Nyx Professional Makeup Pore Filler Makyaj Bazı;1459.90
L'Oreal Paris Infaillible 24H Kapatıcı 326 Vanilla;1799.90
Note 3 in 1 Healthy Skin Light Tinted Moisturizer SPF 50 Renk Ton Eşitleyici Aydınlatıcı Krem;949.90
L'Oreal Paris True Match Bakım Yapan Fondöten 2N Vanilla;1699.90
L'Oreal Paris Infaillible 24H Kapatıcı 323 Fawn;1799.90
Nyx Professional Makeup Make em Wonder Fondöten 03 Fair;999.90
Flormar Sheer Up Ruj No: 009 Baby Girl;869.90
Nascita Garden Fırça Seti 4'lü;479.90
Maybelline New York Sky High Tubes Maskara;1699.90
Nyx Professional Makeup Fat Oil Slick Click Parlatıcı Dudak Balmı 04 Going Viral;1049.90
Nyx Professional Make Up Lip IV Dudak Parlatıcısı Tint Dripping In Rose;999.90
Maybelline New York Lifter Glaze Shea Yağı ve Hyalüronik Asit içeren Renkli Dudak Balmı 07 Berry Haze;759.90
Nyx Professional Makeup The Super Brow Glue Sabitleyici Kaş Jeli O1;1099.90
Flormar Extreme Tattoo Yoğun Pigmentli Mat Jel Göz Kalemi No: 005 Very Berry;799.90
Maybelline New York Superstay Mat Ink Unnude Ruj 65 Seductress;1449.90
Golden Rose Strobing Highlighter Paleti;1144.90
Pastel Beauty Filter Fixing Powder Pudra 00;734.90
Revolution Reloaded Dare to Divulge Aydınlatıcı;749.90
Nyx Professional Makeup Bridgerton Royal Dudak Kombo Kiti 01;1999.90
Note Cosmetique 3 in 1 Healthy Skin Light Tinted Moisturizer SPF 50 Renk Ton Eşitleyici Aydınlatıcı Krem 00 Açık Ton;949.90
Maybelline New York Lifter Liner Dudak Kalemi 05 On It;849.90
Maybelline New York Lash Sensational Body Maskara;1699.90
Maybelline New York Lifter Kafein ve Peptitler İçeren Nemlendiren ve Aydınlatan Kapatıcı 15;1099.90
Note Makyaj Sabitleyici Transparan Pudra;899.90
Essence I Love Extreme Crazy Volume Maskara;239.90
Note Bb Kapatıcı No: 01;899.90
Unfilter Beauty Lip Gloss 08 Chill Baby;299.90
Nyx Professional Makeup Make em Wonder Fondöten 06 Light;999.90
Nyx Professional Makeup Buttermelt Highlighter Kremsi Pudra Aydınlatıcı 15 U Butta Werk;1149.90
Nyx Professional Makeup Bridgerton Royal Dudak Kombo Kiti 05;1999.90
L’Oreal Paris Panorama Hacim Veren Maskara All Night Black Siyah;1799.90
Revolution Cheek Kit Allık Paleti Take A Breather;934.90
Nyx Professional Makeup Fat Oil Slick Click Parlatıcı Dudak Balmı 05 Link In My Bio;1049.90
Revolution Felt and Kohl Eyeliner Kahverengi;499.90
Nyx Professional Makeup Buttermelt Glaze Sticks Aydınlatıcı 01;999.90
Nyx Professional Makeup Lip Lingerie Stain Dudak Kalemi 09 Send Nudes;949.90
Revolution Reloaded Far Paleti Iconic 3.0;934.90
Revolution Ultra Bronzer Medium;814.90
Maybelline New York Lifter Kafein ve Peptitler İçeren Nemlendiren ve Aydınlatan Kapatıcı 05;1099.90
Flormar Baked BlushOn Yoğun Pigmentli Fırınlanmış Allık No: 040;1049.90
Nyx Professional Makeup Buttermelt Bronzer 04 Butta Buscuit;1149.90
Flormar Kontür Stick 03 Medium Deep;1049.90
Nyx Professional Makeup Fat Oil Lip Drip Parlatıcı Dudak Yağı Status Update;1049.90
L'Oreal Paris Hyaluron Lip Tint 601 Worth It;1449.90
Kiss Impress Color Kendinden Yapışkanlı Takma Tırnak Uzun Kırmızı Medium 510 30'lu;599.90
L'Oreal Paris Infaillible Matte Resistance Likit Mat Ruj 635 Worth It (Medium);1999.90
Maybelline New York Cloudtopia Köpük Dokulu Mat Allık 03 Divine Crimson;1199.90
Revolution Ultra Allık Paleti Golden Sugar;999.90
Flormar Stay Perfect Yoğun Pigmentli Likit Kapatıcı 001 Fair;1049.90
Unfilter Beauty Lip & Cheek 52 Soft But Cool;349.90
Maybelline New York Fit Me Kapatıcı 05 Ivory;949.90
Nyx Professional Makeup Make em Wonder Fondöten 04 Cool Porcelain;999.90
SKIN SENSUAL SPF 50+ BB KREM LIGHT 50ML;799.90
Maybelline New York Superstay Mat Ink Unnude Ruj 80 Ruler;1449.90
Nyx Professional Makeup Wonder Stick Çift Taraflı Krem Kontür & Aydınlatıcı Stick Fair;1449.90
Nyx Professional Makeup Make em Wonder Fondöten 010 Nude;999.90
Nyx Professional Makeup Butter Gloss Dudak Parlatıcısı Madeleine;749.90
Note New Era Skin Protect Kapatıcı 30;749.90
Nyx Professional Makeup Wonder Snatch Nemlendirme Etkili Kapatıcı 12 Natural;749.90
Nyx Professional Makeup Lip Lingerie Stain Dudak Kalemi 07 Cuff Me;949.90
Nyx Professional Make Up Lip IV Dudak Parlatıcısı Tint Hydra Honey;999.90
L'Oreal Paris True Match Bakım Yapan Fondöten 2R Rose Vanilla;1699.90
Note Bb Kapatıcı No: 02;899.90
Revolution Reloaded Far Paleti Provocative;934.90
Kiss Impress Color Kendinden Yapışkanlı Takma Tırnak Kısa Bordo 014;599.90
Flormar Sheer Up Ruj No: 015 Go For Bordeaux;869.90
Nyx Professional Makeup Make em Wonder Fondöten 012 Natural;999.90
Nyx Professional Makeup Simpsons Koleksiyonu Mega Glue Şeffaf Kaş ve Saç Sabitleyici;1149.90
Maybelline New York Colossal Bubble Maskara;1149.90
Nyx Professional Makeup Jelly Job Dudak Parlatıcısı Jelly Filled;949.90
Rimmel London Scandaleyes Lycra Flex Maskara Siyah;629.90
Flormar Stay Perfect Yoğun Pigmentli Likit Kapatıcı 002 Light;1049.90
Maybelline New York Hyper Precise All Day Eyeliner 701 Mat Onyx;1149.90
Revolution Loose Baking Pudra Translucent;899.90
Flormar Extreme Tattoo Suya Dayanıklı ve Uzun Süre Kalıcı Jel Göz Kalemi Siyah;799.90
Nascita Garden Fondöten Fırçası;309.90
Nyx Professional Makeup Fat Oil Lip Drip Parlatıcı Dudak Yağı Missed Call;1049.90
Nyx Professional Makeup Buttermelt Blush Kremsi Pudra Allık 07 Butta With Me;1149.90
Nyx Professional Makeup Jelly Job Dudak Parlatıcısı Jelly Jammin;949.90
Pure Beauty Cushion Krem Natural 12 g;1599.90
Nyx Professional Makeup Jelly Job Dudak Parlatıcısı Bling Me Jelly;949.90
Flormar Sheer Up Ruj No: 018 Enchanted Kiss;869.90
Maybelline New York Super Stay Skin Tint Fondöten 05;2049.90
Pastel Beauty Filter Fixing Powder Pudra 01;734.90
Nyx Professional Makeup Control Freak Kaş Sabitleyici Jel;999.90
Revolution Conceal & Define C1 Kapatıcı;814.90
The Purest Solutions Hydra Serum Fondöten Light 30 ml;1099.90
Flormar Puffy Likit Allık No: 03 Rosy Glow;699.90
Nyx Professional Makeup Lip Lingerie Stain Dudak Kalemi 05 Lip Lock;949.90
Nyx Professional Makeup Jelly Job Dudak Parlatıcısı Cherry Jelly;949.90
Maybelline New York Cloudtopia Köpük Dokulu Mat Allık 04 Pink Daydream;1199.90
L'Oreal Paris Infaillible Matte Resistance Likit Mat Ruj 115 Snooze Your Alarm;1999.90
Maybelline New York Fit Me Kapatıcı 15 Fair;949.90
Nascita Pro Eğimli Kontür Fırçası;564.90
Revolution Reloaded Far Paleti Marvellous Mattes;934.90
Nyx Professional Makeup Buttermelt Glaze Işıltılı Nemlendirici Tint 02 Vanilla Bean Butta;899.90
Kiss Impress Color Kendinden Yapışkanlı Takma Tırnak Uzun Açık Pembe Medium 502;599.90
Maybelline New York Super Stay Skin Tint Fondöten 03;2049.90
Nyx Professional Makeup Wonder Snatch Nemlendirme Etkili Kapatıcı 10 Light Beige;749.90
Nyx Professional Makeup Fat Oil Slick Click Parlatıcı Dudak Balmı 03 No Filter Needed;1049.90
Watsons Pompalı Asetonsuz Oje Çıkarıcı 450 ml;169.90
Flormar Puffy Aydınlık Bitişli Sünger Aplikatörlü Likit Kontür No: 01 Amber;699.90
Flormar Puffy Likit Allık No: 02 Peachy Glow;699.90
Flormar Hero Volume&Curl Brown Maskara;1049.90
Nyx Professional Makeup Buttermelt Glaze Sticks Aydınlatıcı 04;999.90
Revolution The Icon Smokey Grunge Far Paleti;1809.90
Note Mineral Kapatıcı No: 201;849.90
Maybelline New York Babyskin Primer Pore Eraser;829.90
Nyx Professional Makeup Jelly Job Dudak Parlatıcısı Jellybean;949.90
Nyx Professional Makeup Butter Gloss Dudak Parlatıcısı Tiramisu;749.90
Maybelline New York Lifter Glaze Shea Yağı ve Hyalüronik Asit içeren Renkli Dudak Balmı 06 Caramel Glow;759.90
I Heart Revolution Snack Stacks Cherry Far Paleti;1499.90
Maybelline New York Volum Express Rocket Maskara Ekstra Siyah;899.90
Nyx Professional Makeup Jelly Job Dudak Parlatıcısı Toast N Jelly;949.90
Flormar Sheer Up Ruj No: 022 Daring Whisper;869.90
Unfilter Beauty Lip & Cheek 33 Love Call;349.90
Maybelline New York Lifter Lip Gloss Moon No: 03;1299.90
Nyx Professional Makeup Buttermelt Glaze Sticks Aydınlatıcı 06;999.90
Revolution Reloaded Dimension Neutral Charm Far Paleti;934.90
L'Oreal Paris True Match Nude Fondöten Serum 2 3 Light;2549.90
Deborah Milano Extraordinary 5in1 Maskara Siyah;869.90
SKIN SENSUAL SPF 50+ BB KREM EXTRA LIGHT 50ML;799.90
Pure Beauty Matte Cushion 01 Ivory SPF50 PA++++ 12 g;1599.90
Nyx Professional Makeup Holiday 25 Candy Swirl Liner Spice Spice Baby;929.90
Essence Line N' Stain! Tattoo Dudak Kalemi 02;189.90
Revolution Hot Spice Ultra Allık Paleti;999.90
Maybelline New York Serum Etkili Hyaluronik Asit ve Besleyici Yağ İçeren Ruj Satin Crop Top 001;1049.90
L'Oreal Paris Infaillible Matte Resist Likit Ruj 420 Le Rouge Paris;1999.90
Golden Rose Emily Dudak Kalemi No: 203;114.90
Maybelline New York Serum Etkili Hyaluronik Asit ve Besleyici Yağ İçeren Ruj Satin Blind Date 107;1049.90
Revolution Juicy Peptide Lip Balm Nude Latte;1124.90
Golden Rose False Lashes Maskara;619.90
Revolution Reloaded Far Paleti Sugar Pie;934.90
L'Oreal Paris Infaillible 24H Micro Precision Kaş Kalemi Blonde;609.90
Nyx Professional Makeup Buttermelt Highlighter Kremsi Pudra Aydınlatıcı 10 Glaze It Butta;1149.90
Nascita Blue Dreams Göz Fırça Seti 4'lü;349.90
Kiss Impress Color Nar Çiçeği Kısa 013;599.90
Flormar Brow Setter Uzun Süre Kalıcı Sabitleyici Kaş Bazı Şeffaf;549.90
Pastel Express Volume + Length Maskara;699.90
Maybelline New York Lifter Glaze Shea Yağı ve Hyalüronik Asit içeren Renkli Dudak Balmı 02 Pink Drip;759.90
Solingen Et Pensi 4230G;1399.90
Watsons Koyu Renk Ojeler için Aseton 150 ml;109.90
L'Oreal Paris Infaillible 24H Kapatıcı 327 Cashmere;1799.90
Maybelline New York Fit Me Mat Poreless Fondöten 110 Porcelain;1049.90
Flormar Perfect Coverage Yoğun Pigmentli SPF15 Fondöten No: 105;1099.90
L'Oreal Paris Plump Ambition Hyaluron Dudak Yağı No: 601;1199.90
Flormar Suya Dayanıklı Mat Göz Kalemi No: 001;549.90
L'Oreal Paris Hyaluron Lip Tint 635 Worth It Medium;1449.90
Flormar Matte Waterproof Yoğun Pigmentli Mat Dipliner No: 001;899.90
Mia Klinika Kaş Kirpik Serumu;709.90
Nyx Professional Makeup The Brow Glue Instant Brow Styler Kaş Sabitleyici Maskara Taupe;1099.90
Flormar Baked BlushOn Yoğun Pigmentli Fırınlanmış Allık No: 044;1049.90
Nascita Happy Candy Sünger Seti 2'li;134.90
Golden Rose Smart Glow Likit Aydınlatıcı 201;619.90
Note Mineral Kapatıcı No: 202;849.90
Nascita Garden Açılı Allık Fırçası;254.90
L'Oreal Paris Hyaluron Lip Tint 640 Tea Time;1449.90
Unfilter Beauty Lip Gloss 07 Bliss Me;299.90
Essence Extreme Lengthening & Volume Maskara 01;299.90
Show By Pastel Show Your Peace Transparent Eyebrow & Eyelash Mascara Transparan Kaş ve Kirpik Maskarası;589.90
Pastel Stardust Highlighter Aydınlatıcı 320 Vega;599.90
Unfilter Beauty Lipgloss 04 Fancy Lips;299.90
Maybelline New York Lifter Liner Dudak Kalemi 013 Maybe It's;849.90
Nascita Açılır Kapanır Yüz Ustura Seti 2'li;214.90
Maybelline New York Lifter Liner Dudak Kalemi 07 Big Lift;849.90
Maybelline New York Fit Me Kapatıcı No: 10 Light;949.90
Solingen Makas 4022G;659.90
Nascita Blue Dreams Açılı Allık Fırçası;159.90
Kalyon Tırnak Besleyici;264.90
L'Oreal Paris Telescopic Lift Extra Black Maskara;2249.90
The Purest Solutions Hydra BB Krem Light 40 ml;999.90
Revolution Wrap Lash Maskara Black;2124.90
Rimmel London Scandaleyes Kohl Kajal Göz Kalemi Siyah;437.90
Note BB Krem No: 200;949.90
Maybelline New York Lifter Liner Dudak Kalemi 011 Upstate;849.90
Flormar Color Treasure Yoğun Pigment Veren Renkli Maskara - 001 Sapphire;949.90
Nyx Professional Makeup Lift and Snatch Kaş Kalemi Pen Espress;1199.90
Note Nemlendirici Yumuşak Stick Allık 20 Rosy;799.90
Maybelline New York Serum Etkili Hyaluronik Asit ve Besleyici Yağ İçeren Ruj Satin Maybe It's 002;1049.90
The Purest Solutions Tone Serum Fondöten Light 30 ml;1099.90
L'Oreal Paris Infaillible 24H Kapatıcı 330 Pecan;1799.90
Maybelline New York Superstay Mat Ink Unnude Ruj 70 Amazonian;1449.90
Maybelline New York Brow Insert Çift Uçlu Kaş Kalemi 4.5;1449.90
Revolution Reloaded Far Paleti Spirited Love;934.90
Show By Pastel Show Your Joy Liquid Blush Likit Allık 57;589.90
Deborah Milano Super Gloss Brown Rose No: 09;399.90
Pastel Multidimensional Volume&Curl Mascara Maskara;999.90
Pastel Make Up To Skin Care Hydrating Göz Altı Kapatıcısı ve Göz Kremi 63 Milkshake;999.90
Golden Rose Mineral Terracotta Pudra No: 01;1059.90
Revolution Pressed Pudra Pops Banana;999.90
Pastel Stardust Highlighter Aydınlatıcı 322 Spica;599.90
Frudia Make Up Glow Juicy Jam Lip & Cheek Berry 03;999.90
Flormar Baked Blush-On Yoğun Pigmentli Fırınlanmış Allık No: 050;1049.90
Nascita Pratik Manikür & Pedikür Seti;369.90
Essence Line N' Stain! Tattoo Dudak Kalemi 01;189.90
Frudia Make Up Glow Juicy Jam Lip & Cheek Berry 01;999.90
Flormar Big N Bold Hero Kirpik Uzatıcı ve Dolgunlaştırıcı Maskara Siyah;669.90
Revolution The Cherry Icon Rich Berry Far Paleti;1809.90
Maybelline New York Serum Etkili Hyaluronik Asit ve Besleyici Yağ İçeren Ruj Satin Open Late 003;1049.90
Nyx Professional Makeup Wonder Stick Çift Taraflı Krem Kontür & Aydınlatıcı Stick Universal Light;1449.90
Nyx Professional Makeup Buttermelt Glaze Sticks Aydınlatıcı 03;999.90
Revolution Reloaded Bronzer Holiday Romance;749.90
Nascita Garden Küçük Kapatıcı Fırçası;199.90
Unfilter Beauty Lipgloss 29 This Is Hot;299.90
Pastel Cream Blush Krem Allık 41 Dazzling;559.90
Nascita Makyaj Fırçası Seyahat Boy 5'li;449.90
Maybelline New York Super Stay Lumi Matte Fondöten No: 118;1649.90
Essence I Love Extreme Volume Up Wp Maskara 01 Brown;237.90
Nascita Pro Yuvarlak Açılı Allık Fırçası;444.90
Revolution Conceal & Define Mat Bitişli Kapatıcı C2;814.90
Note BB Krem No: 01;949.90
Flormar Hero Kıvırıcı ve Dolgunlaştırıcı Maskara Siyah;1049.90
Pastel Big N Black Maskara;699.90
Frudia Make Up Glow Juicy Jam Lip & Cheek Peach 04;999.90
Flormar All Day Fix Matte Setting Spray;999.90
Nyx Professional Makeup Lip Lingerie Stain Dudak Kalemi 010 Up All Night;949.90
Maybelline New York Super Lock Brow Glue Kaş Sabitleyici Maskara Deep Brown;1299.90
Golden Rose Mood Gleamy Dudak Parlatıcısı No: 202 Peachy Nude;539.90
Revolution Smiley Superfix Happy Fixing Spray;1799.90
Nyx Professional Makeup Fat Oil Lip Drip Parlatıcı Dudak Yağı Newsfeed;1049.90
Golden Rose Makyaj Sabitleyici Sprey;649.90
Flormar Gel Look Top Coat;199.90
L’Oreal Paris Le Shadow Stick Göz Farı 230 Magnetic Bronze;1199.90
Pastel Make Up To Skin Care Hydrating Göz Altı Kapatıcısı ve Göz Kremi 62 Ivory;999.90
Maybelline New York Brow Insert Çift Uçlu Kaş Kalemi 02;1449.90
Nascita Pro Açılı Allık Fırçası;444.90
Note 3in1 Serum Concealer Nemlendirici ve Aydınlatıcı Göz Altı Kapatıcısı 10 Medium;899.90
L'Oreal Paris Plump Ambition Hyaluron Dudak Yağı No: 390;1199.90
Frudia Make Up Glow Juicy Jam Lip & Cheek Fig 08;999.90
Show By Pastel Show Your Joy Liquid Blush Likit Allık 53;589.90
Frudia Make Up Glow Juicy Jam Lip & Cheek Papaya 02;999.90
L'Oreal Paris C'est Magic BB Krem 02 Light;1499.90
Flormar Color Treasure Yoğun Pigment Veren Renkli Maskara - 003 Rose Quartz;949.90
Golden Rose Essential High Def ve Lift ve Great Volume Maskara;469.90
Flormar To Go Yoğunluğu Ayarlanabilir & Doğal Bitişli Kremsi Stick Bronzer - 002 Biscuit;499.90
Flormar Yarı Mat Dokulu İnce Uçlu Dipliner Siyah;849.90
Flormar Puffy Likit Allık No: 01 Pinky Glow;699.90
Maybelline New York Lifter Niasinamid ve Hyalüronik Asit İçeren Aydınlatan Fondöten 112;1299.90
Maybelline New York Lifter Gloss Nemlendirici Dudak Parlatıcısı 009 Topaz;1299.90
Pastel x Arzu Sabancı Maskara;1029.90
Flormar Midnight Matte Mat Bitişli Kalem Likit Eyeliner Siyah;849.90
Maybelline New York Lasting Drama Automatic Liner Göz Kalemi Brown Sugar;439.90
Pastel x Arzu Sabancı Oje Seti No: 2;449.90
Note 3in1 Serum Concealer Nemlendirici ve Aydınlatıcı Göz Altı Kapatıcısı 00 Light;899.90
Revolution Superfix Grip Makyaj Bazı;949.90
Flormar Creamy Stylo Yarı Parlak Bitişli Kremsi Ruj No: 006;599.90
Pastel x Arzu Sabancı 2'li Allık Seti;794.90
Miine Makyaj Çantası Pvc Siyah 3'lü;799.90
Unfilter Beauty Lip & Cheek 45 Flirt Alert;349.90
Revolution Allık & Aydınlatıcı Stick Mauve Glow;814.90
Maybelline New York Lash Sensational Firework Maskara;1699.90
Flormar Brow Up Highlighter Kaş Altı Aydınlatıcı Asansörlü Kalem Stick Diamond 001;749.90
Essence All About Mat Fixing Compact Pudra;229.90
Revolution Professional Oil Control Fixing Sabitleyici Sprey;1064.90
Deborah Milano Skin Booster Serum Fondöten 02;1589.90
Pastel Make Up To Skin Care Hydrating Göz Altı Kapatıcısı ve Göz Kremi 65 Honeybun;999.90
Maybelline New York Instant Anti Age Eraser Kapatıcı 05 Brighten;1399.90
Note Iconic Sheer Ruj 203;699.90
Superdrug Studio London Fırça Seti 7'li;999.90
Golden Rose Smart Glow Likit Aydınlatıcı 203;619.90
Revolution Skin Silk Stick Bronzer Stick Fair Sand;1064.90
Maybelline New York Lifter Kafein ve Peptitler İçeren Nemlendiren ve Aydınlatan Kapatıcı 20;1099.90
Revolution Skin Silk Stick Allık Rosy Cheeks;1064.90
Pastel x Arzu Sabancı 6'lı Far Seti 62;879.90
L'Oreal Paris Infaillible 24H Kapatıcı 328 Lin;1799.90
Nyx Professional Make Up Lip IV Dudak Parlatıcısı Tint Mocha Me Wet;999.90
Note Nemlendirici Etkili Işıltılı Likit Allık 20 Coral;649.90
Nyx Professional Makeup Wonder Snatch Nemlendirme Etkili Kapatıcı 14 Medium Olive;749.90
Nascita 4'lü Makyaj Sünger Seti;219.90
Golden Rose Kaş ve Kirpik Maskarası Şeffaf;579.90
Deborah Milano 24Ore Compact Long Lasting Fondöten Natural 02;1299.90
Maybelline New York Lifter Gloss Nemlendirici Dudak Parlatıcısı 24 Bubblegum;1099.90
Golden Rose Dipliner Black;509.90
Maybelline New York Lifter Niasinamid ve Hyalüronik Asit İçeren Aydınlatan Fondöten 114;1299.90
Revolution Metallic Muse Shimmer Bomb Lip Gloss;149.00
Pastel x Arzu Sabancı 6'lı Far Seti 61;879.90
Flormar Dewy Lip Glaze Nemlendirici Dudak Parlatıcısı No: 027 Perfect Moments;849.90
Flormar Creamy Stylo Yarı Parlak Bitişli Kremsi Ruj No: 009;599.90
Rimmel London Lasting Finish Fondöten Gold;924.90
Flormar Skin Lifting Sıkılaştırma Etkili SPF30 Fondöten No: 020;1199.90
Revolution Reloaded Allık Rhubarb & Custard;749.90
Flormar Water Lip Stain Kalıcı Mat Dudak Renklendiricisi No: 002;799.90
Nyx Professional Makeup Jelly Job Dudak Parlatıcısı Jelly Blushin;949.90
Golden Rose Flash Lash Maskara No: 11 Chocolate;619.90
L’Oreal Paris Infaillible Göz Kalemi 13 Velvet Bordeaux;1099.90
Nyx Professional Make Up Lip IV Dudak Parlatıcısı Tint Water Bout Wine;999.90
L'Oreal Paris Infaillible Faux Brow Ultra İnce Uçlu Kaş Kalemi Light Brunette;1349.90
Golden Rose Smart Cheek Likit Allık 108;619.90
I Heart Revolution Loose Baking Pudra Coconut;1389.90
L'Oreal Paris Color Riche Intense Volume Mat Ruj No: 640 Nude Independant;1699.90
Golden Rose City Style Yüz ve Göz Paleti No: 01 Warm Nude;1119.90
Flormar Yoğun Mat Kendinden Fırçalı Siyah Jel Eyeliner No: 001 Gel Black;949.90
Maybelline New York Super Stay Skin Tint Fondöten 10;2049.90
Revolution Conceal & Define Fondöten F1;1374.90
Revolution Sunset Shimmer Bomb;999.90
Flormar Perfect Coverage Yoğun Pigmentli SPF15 Fondöten No: 102;1099.90
Maybelline New York Lifter Liner Dudak Kalemi 06 Line Leader;849.90
Essence Bright Eyes! Gözaltı Stick Kapatıcı No: 01;249.90
Deborah Milano 24Ore All Over Kapatıcı Waterproof 01 Fair;914.90
L’Oreal Paris Lumi Blush Likit Allık 640 Glowy Rouge Paris;1199.90
Rimmel London Lasting Finish Multi Tasker Kapatıcı No: 10;849.90
Note Baked Allık No: 06;799.90
Revolution Duo Brow Kalem Medium Brown;414.90
Pastel x Arzu Sabancı Duo Bronzer & Aydınlatıcı Set;779.90
Nyx Professional Makeup Lip Lingerie Stain Dudak Kalemi 03 Barely There;949.90
Flormar Waterproof Lipliner Suya Dayanıklı Dudak Kalemi Nude;399.90
Deborah Milano Instant Lift Kapatıcı No: 00 Ivory 4.2 g;999.90
Deborah Milano Instant Lift Kapatıcı No: 03 Sand 4.2 g;999.90
Unfilter Beauty Lipgloss 10 Toffee Melt;299.90
Nyx Professional Makeup Plump Right Back Makyaj Bazı + Serum;1599.90
Watsons 5'li Manikür Seti;399.90
Pastel Moonlight Highlighter Aydınlatıcı 100;539.90
